,ID,Local_ID,Language_ID,Parameter_ID,Value,Form,Segments,Comment,Source,Cognacy,Loan,Graphemes,Profile,asjp_forms,asjp_segs
1002,Kurukh-47_lie-1,994,Kurukh,47_lie,paiha,paiha,p a i h a,,KolipakamFW,,False,^ p a i h a $,default,p a i h a,a h i p
1003,Kurukh-47_lie-2,995,Kurukh,47_lie,fasija:r,fasija:r,f a s i j aː r,,KolipakamFW,,False,^ f a s i j a: r $,default,f a s i y a r,a f i r s y
1004,Gondi-47_lie-2,996,Gondi,47_lie,dolsi,dolsi,d o l s i,,KolipakamFW,,False,^ d o l s i $,default,d o l s i,d i l o s
1005,Kannada-48_liver-1,997,Kannada,48_liver,hīri,hīri,h iː r i,,Andronov1964,,False,^ h ī r i $,default,h i r i,h i r
1006,Kota-48_liver-1,998,Kota,48_liver,i:ru,i:ru,iː r u,,KolipakamFW,,False,^ i: r u $,default,i r u,i r u
1007,Malayalam-48_liver-1,999,Malayalam,48_liver,īral,īral,iː r a l,,Andronov1964,,False,^ ī r a l $,default,i r a l,a i l r
1008,Tamil-48_liver-1,1000,Tamil,48_liver,i:ɾaɭ,i:ɾaɭ,iː ɾ a ɭ,,Andronov1964,,False,^ i: ɾ a ɭ $,default,i r a L,L a i r
1009,Kolami-48_liver-1,1001,Kolami,48_liver,kaleja,kaleja,k a l e j a,,KolipakamFW,,False,^ k a l e j a $,default,k a l e y a,a e k l y
1010,Koya-48_liver-1,1002,Koya,48_liver,ka:dʒam,ka:dʒam,k aː dʒ a m,,KolipakamFW,,False,^ k a: dʒ a m $,default,k a dZ a m,a dZ k m
1011,Telugu-48_liver-1,1003,Telugu,48_liver,ka:lejamu,ka:lejamu,k aː l e j a m u,,KolipakamFW,,False,^ k a: l e j a m u $,default,k a l e y a m u,a e k l m u y
1012,Gondi-48_liver-1,1004,Gondi,48_liver,taɾki,taɾki,t a ɾ k i,,KolipakamFW,,False,^ t a ɾ k i $,default,t a r k i,a i k r t
1013,Ollari_Gadba-48_liver-1,1005,Ollari_Gadba,48_liver,taɖing,taɖing,t a ɖ i n g,,KolipakamFW,,False,^ t a ɖ i n g $,default,t a d i n g,a d g i n t
1014,Parji-48_liver-1,1006,Parji,48_liver,taruṅg,taruṅg,t a r u ŋ g,,Andronov1964,,False,^ t a r u ṅ g $,default,t a r u N g,N a g r t u
1015,Malayalam-48_liver-2,1007,Malayalam,48_liver,kaɾaɭə,kaɾaɭə,k a ɾ a ɭ ə,,KolipakamFW,,False,^ k a ɾ a ɭ ə $,default,k a r a L 3,3 L a k r
1016,Toda-48_liver-1,1008,Toda,48_liver,kuɖa:l,kuɖa:l,k u ɖ aː l,,KolipakamFW,,False,^ k u ɖ a: l $,default,k u d a l,a d k l u
1017,Kodava-48_liver-1,1009,Kodava,48_liver,tombe,tombe,t o m b e,,KolipakamFW,,False,^ t o m b e $,default,t o m b e,b e m o t
1018,Yeruva-48_liver-1,1010,Yeruva,48_liver,tombe,tombe,t o m b e,,KolipakamFW,,False,^ t o m b e $,default,t o m b e,b e m o t
1019,Kannada-48_liver-2,1011,Kannada,48_liver,medadʒi:ɾika,medadʒi:ɾika,m e d a dʒ iː ɾ i k a,,KolipakamFW,,False,^ m e d a dʒ i: ɾ i k a $,default,m e d a dZ i r i k a,a d dZ e i k m r
1020,Betta_Kurumba-48_liver-1,1012,Betta_Kurumba,48_liver,tədlə,tədlə,t ə d l ə,,KolipakamFW,,False,^ t ə d l ə $,default,t 3 d l 3,3 d l t
1021,Brahui-48_liver-1,1013,Brahui,48_liver,dʒagaɾ,dʒagaɾ,dʒ a g a ɾ,,KolipakamFW,,False,^ dʒ a g a ɾ $,default,dZ a g a r,a dZ g r
1022,Malto-48_liver-1,1014,Malto,48_liver,tʃedɾo,tʃedɾo,tʃ e d ɾ o,,KolipakamFW,,False,^ tʃ e d ɾ o $,default,tS e d r o,d e o r tS
1023,Kurukh-48_liver-1,1015,Kurukh,48_liver,umbalkʰo,umbalkʰo,u m b a l kʰ o,,KolipakamFW,,False,^ u m b a l kʰ o $,default,u m b a l kh~ o,a b kh~ l m o u
1024,Kota-49_long-1,1016,Kota,49_long,ni:tam,ni:tam,n iː t a m,,KolipakamFW,,False,^ n i: t a m $,default,n i t a m,a i m n t
1025,Malayalam-49_long-1,1017,Malayalam,49_long,ni:nɖa,ni:nɖa,n iː n ɖ a,,KolipakamFW,,False,^ n i: n ɖ a $,default,n i n d a,a d i n
1026,Malayalam-49_long-2,1018,Malayalam,49_long,ni:lamuɭɭa,ni:lamuɭɭa,n iː l a m u ɭː a,,KolipakamFW,,False,^ n i: l a m u ɭɭ a $,default,n i l a m u L a,L a i l m n u
1027,Tamil-49_long-1,1019,Tamil,49_long,nīṇṭa,nīṇṭa,n iː ɳ ʈ a,,Andronov1964,,False,^ n ī ṇ ṭ a $,default,n i n t a,a i n t
1028,Tamil-49_long-2,1020,Tamil,49_long,ni:ɭam,ni:ɭam,n iː ɭ a m,,KolipakamFW,,False,^ n i: ɭ a m $,default,n i L a m,L a i m n
1029,Tamil-49_long-3,1021,Tamil,49_long,ni:ɭama:na,ni:ɭama:na,n iː ɭ a m aː n a,,KolipakamFW,,False,^ n i: ɭ a m a: n a $,default,n i L a m a n a,L a i m n
1030,Yeruva-49_long-1,1022,Yeruva,49_long,ni:ʈa,ni:ʈa,n iː ʈ a,,KolipakamFW,,False,^ n i: ʈ a $,default,n i t a,a i n t
1031,Badga-49_long-1,1023,Badga,49_long,utta,utta,u tː a,,KolipakamFW,,False,^ u tt a $,default,u t a,a t u
1032,Betta_Kurumba-49_long-1,1024,Betta_Kurumba,49_long,uddu,uddu,u d d u,,KolipakamFW,,False,^ u d d u $,default,u d d u,d u
1033,Kannada-49_long-1,1025,Kannada,49_long,udda,udda,u d d a,,KolipakamFW,,False,^ u d d a $,default,u d d a,a d u
1034,Kodava-49_long-1,1026,Kodava,49_long,uddə,uddə,u d d ə,,KolipakamFW,,False,^ u d d ə $,default,u d d 3,3 d u
1035,Tulu-49_long-1,1027,Tulu,49_long,uda,uda,u d a,,KolipakamFW,,False,^ u d a $,default,u d a,a d u
1036,Kolami-49_long-1,1028,Kolami,49_long,poɖa:m,poɖa:m,p o ɖ aː m,,KolipakamFW,,False,^ p o ɖ a: m $,default,p o d a m,a d m o p
1037,Koya-49_long-1,1029,Koya,49_long,poɖaʋuʈa:du,poɖaʋuʈa:du,p o ɖ a ʋ u ʈ aː d u,,KolipakamFW,,False,^ p o ɖ a ʋ u ʈ a: d u $,default,p o d a v u t a d u,a d o p t u v
1038,Telugu-49_long-1,1030,Telugu,49_long,poɖaʋu,poɖaʋu,p o ɖ a ʋ u,,KolipakamFW,,False,^ p o ɖ a ʋ u $,default,p o d a v u,a d o p u v
1039,Toda-49_long-1,1031,Toda,49_long,neɾti,neɾti,n e ɾ t i,,KolipakamFW,,False,^ n e ɾ t i $,default,n e r t i,e i n r t
1040,Brahui-49_long-1,1032,Brahui,49_long,muɾgun,muɾgun,m u ɾ g u n,,KolipakamFW,,False,^ m u ɾ g u n $,default,m u r g u n,g m n r u
1041,Kurukh-49_long-1,1033,Kurukh,49_long,diga:h,diga:h,d i g aː h,,KolipakamFW,,False,^ d i g a: h $,default,d i g a h,a d g h i
1042,Malto-49_long-1,1034,Malto,49_long,digaɖo,digaɖo,d i g a ɖ o,,KolipakamFW,,False,^ d i g a ɖ o $,default,d i g a d o,a d g i o
1043,Gondi-49_long-1,1035,Gondi,49_long,la:m,la:m,l aː m,,KolipakamFW,,False,^ l a: m $,default,l a m,a l m
1044,Betta_Kurumba-50_louse-1,1036,Betta_Kurumba,50_louse,pja:nu,pja:nu,p j aː n u,,KolipakamFW,,False,^ p j a: n u $,default,p y a n u,a n p u y
1045,Kannada-50_louse-1,1037,Kannada,50_louse,he:nu,he:nu,h eː n u,,KolipakamFW,,False,^ h e: n u $,default,h e n u,e h n u
1046,Kodava-50_louse-1,1038,Kodava,50_louse,pe:nə,pe:nə,p eː n ə,,KolipakamFW,,False,^ p e: n ə $,default,p e n 3,3 e n p
1047,Kolami-50_louse-1,1039,Kolami,50_louse,pa:nu,pa:nu,p aː n u,,KolipakamFW,,False,^ p a: n u $,default,p a n u,a n p u
1048,Kurukh-50_louse-1,1040,Kurukh,50_louse,pe:n,pe:n,p eː n,,KolipakamFW,,False,^ p e: n $,default,p e n,e n p
1049,Malayalam-50_louse-1,1041,Malayalam,50_louse,pe:n,pe:n,p eː n,,KolipakamFW,,False,^ p e: n $,default,p e n,e n p
1050,Parji-50_louse-1,1042,Parji,50_louse,pēni,pēni,p eː n i,,Andronov1964,,False,^ p ē n i $,default,p e n i,e i n p
1051,Tamil-50_louse-1,1043,Tamil,50_louse,pe:nə,pe:nə,p eː n ə,,Andronov1964,,False,^ p e: n ə $,default,p e n 3,3 e n p
1052,Telugu-50_louse-1,1044,Telugu,50_louse,pe:nu,pe:nu,p eː n u,,KolipakamFW,,False,^ p e: n u $,default,p e n u,e n p u
1053,Tulu-50_louse-1,1045,Tulu,50_louse,pe:n,pe:n,p eː n,,KolipakamFW,,False,^ p e: n $,default,p e n,e n p
1054,Yeruva-50_louse-1,1046,Yeruva,50_louse,pe:nə,pe:nə,p eː n ə,,KolipakamFW,,False,^ p e: n ə $,default,p e n 3,3 e n p
1055,Toda-50_louse-1,1047,Toda,50_louse,iɾs,iɾs,i ɾ s,,KolipakamFW,,False,^ i ɾ s $,default,i r s,i r s
1056,Gondi-50_louse-1,1048,Gondi,50_louse,poɾki,poɾki,p o ɾ k i,,KolipakamFW,,False,^ p o ɾ k i $,default,p o r k i,i k o p r
1057,Koya-50_louse-1,1049,Koya,50_louse,poɾiki,poɾiki,p o ɾ i k i,,KolipakamFW,,False,^ p o ɾ i k i $,default,p o r i k i,i k o p r
1058,Badga-50_louse-1,1050,Badga,50_louse,ili,ili,i l i,,KolipakamFW,,False,^ i l i $,default,i l i,i l
1059,Badga-50_louse-2,1051,Badga,50_louse,kili,kili,k i l i,,KolipakamFW,,False,^ k i l i $,default,k i l i,i k l
1060,Brahui-50_louse-1,1052,Brahui,50_louse,bo:dʰ,bo:dʰ,b oː dʱ,,KolipakamFW,,False,^ bo:dʰ $,default,b o d,b d o
1061,Kota-50_louse-1,1053,Kota,50_louse,paiji,paiji,p a i j i,,KolipakamFW,,False,^ p a i j i $,default,p a i y i,a i p y
1062,Kodava-51_man-1,1054,Kodava,51_man,a:naaɭə,a:naaɭə,aː n a a ɭ ə,,KolipakamFW,,False,^ a: n a a ɭ ə $,default,a n a a L 3,3 L a n
1063,Malayalam-51_man-1,1055,Malayalam,51_man,a:ɳə,a:ɳə,aː ɳ ə,,KolipakamFW,,False,^ a: ɳ ə $,default,a n 3,3 a n
1064,Tamil-51_man-1,1056,Tamil,51_man,a:ɳə,a:ɳə,aː ɳ ə,,Andronov1964,,False,^ a: ɳ ə $,default,a n 3,3 a n
1065,Tamil-51_man-2,1057,Tamil,51_man,a:ɳ,a:ɳ,aː ɳ,,KolipakamFW,,False,^ a: ɳ $,default,a n,a n
1066,Kannada-51_man-1,1058,Kannada,51_man,puruṣa,puruṣa,p u r u ʂ a,LOAN,Andronov1964,,True,^ p u r u ṣ a $,default,p u r u S a,S a p r u
1067,Malayalam-51_man-2,1059,Malayalam,51_man,puɾuʂan,puɾuʂan,p u ɾ u ʂ a n,LOAN,KolipakamFW,,True,^ p u ɾ u ʂ a n $,default,p u r u S a n,S a n p r u
1068,Telugu-51_man-1,1060,Telugu,51_man,puɾuʂuɖu,puɾuʂuɖu,p u ɾ u ʂ u ɖ u,LOAN,KolipakamFW,,True,^ p u ɾ u ʂ u ɖ u $,default,p u r u S u d u,S d p r u
1069,Betta_Kurumba-51_man-1,1061,Betta_Kurumba,51_man,gəɳɖaɭə,gəɳɖaɭə,g ə ɳ ɖ a ɭ ə,,KolipakamFW,,False,^ g ə ɳ ɖ a ɭ ə $,default,g 3 n d a L 3,3 L a d g n
1070,Kannada-51_man-2,1062,Kannada,51_man,ganɖasu,ganɖasu,g a n ɖ a s u,,KolipakamFW,,False,^ g a n ɖ a s u $,default,g a n d a s u,a d g n s u
1071,Kota-51_man-1,1063,Kota,51_man,ganmagu,ganmagu,g a n m a g u,,KolipakamFW,,False,^ g a n m a g u $,default,g a n m a g u,a g m n u
1072,Koya-51_man-1,1064,Koya,51_man,magaʋa:ɳɖ,magaʋa:ɳɖ,m a g a ʋ aː ɳ ɖ,,KolipakamFW,,False,^ m a g a ʋ a: ɳ ɖ $,default,m a g a v a n d,a d g m n v
1073,Telugu-51_man-2,1065,Telugu,51_man,magaʋa:ɖu,magaʋa:ɖu,m a g a ʋ aː ɖ u,,KolipakamFW,,False,^ m a g a ʋ a: ɖ u $,default,m a g a v a d u,a d g m u v
1074,Koya-51_man-2,1066,Koya,51_man,pe:ka:l,pe:ka:l,p eː k aː l,,KolipakamFW,,False,^ p e: k a: l $,default,p e k a l,a e k l p
1075,Badga-51_man-1,1067,Badga,51_man,kanɖumuga,kanɖumuga,k a n ɖ u m u g a,,KolipakamFW,,False,^ k a n ɖ u m u g a $,default,k a n d u m u g a,a d g k m n u
1076,Yeruva-51_man-1,1068,Yeruva,51_man,panija,panija,p a n i j a,,KolipakamFW,,False,^ p a n i j a $,default,p a n i y a,a i n p y
1077,Kuwi-51_man-1,1069,Kuwi,51_man,kakasi,kakasi,k a k a s i,,KolipakamFW,,False,^ k a k a s i $,default,k a k a s i,a i k s
1078,Tamil-51_man-3,1070,Tamil,51_man,a:mbɭe,a:mbɭe,aː m b ɭ e,,KolipakamFW,,False,^ a: m b ɭ e $,default,a m b L e,L a b e m
1079,Toda-51_man-1,1071,Toda,51_man,a:lom,a:lom,aː l o m,,KolipakamFW,,False,^ a: l o m $,default,a l o m,a l m o
1080,Tulu-51_man-1,1072,Tulu,51_man,a:ndʒʋu,a:ndʒʋu,aː n dʒ ʋ u,,KolipakamFW,,False,^ a: n dʒ ʋ u $,default,a n dZ v u,a dZ n u v
1081,Brahui-51_man-1,1073,Brahui,51_man,naɾeenə,naɾeenə,n a ɾ e e n ə,,KolipakamFW,,False,^ n a ɾ e e n ə $,default,n a r e e n 3,3 a e n r
1082,Malto-51_man-1,1074,Malto,51_man,muɖsa:,muɖsa:,m u ɖ s aː,,KolipakamFW,,False,^ m u ɖ s a: $,default,m u d s a,a d m s u
1083,Kurukh-51_man-1,1075,Kurukh,51_man,me:t,me:t,m eː t,,KolipakamFW,,False,^ m e: t $,default,m e t,e m t
1084,Kolami-51_man-1,1076,Kolami,51_man,maniʂa:n,maniʂa:n,m a n i ʂ aː n,,KolipakamFW,,False,^ m a n i ʂ a: n $,default,m a n i S a n,S a i m n
1085,Gondi-51_man-1,1077,Gondi,51_man,mankal,mankal,m a n k a l,,KolipakamFW,,False,^ m a n k a l $,default,m a n k a l,a k l m n
1086,Kuwi-51_man-2,1078,Kuwi,51_man,ɖola,ɖola,ɖ o l a,,KolipakamFW,,False,^ ɖ o l a $,default,d o l a,a d l o
1087,Kuwi-51_man-3,1079,Kuwi,51_man,kodomi,kodomi,k o d o m i,,KolipakamFW,,False,^ k o d o m i $,default,k o d o m i,d i k m o
1088,Kannada-52_many-1,1080,Kannada,52_many,halaʋu,halaʋu,h a l a ʋ u,,KolipakamFW,,False,^ h a l a ʋ u $,default,h a l a v u,a h l u v
1089,Malayalam-52_many-1,1081,Malayalam,52_many,pala,pala,p a l a,,KolipakamFW,,False,^ p a l a $,default,p a l a,a l p
1090,Tamil-52_many-1,1082,Tamil,52_many,palə,palə,p a l ə,,Andronov1964,,False,^ p a l ə $,default,p a l 3,3 a l p
1091,Telugu-52_many-1,1083,Telugu,52_many,nānā,nānā,n aː n aː,,Andronov1964,,False,^ n ā n ā $,default,n a n a,a n
1092,Kodava-52_many-1,1084,Kodava,52_many,dumba,dumba,d u m b a,,KolipakamFW,,False,^ d u m b a $,default,d u m b a,a b d m u
1093,Yeruva-52_many-1,1085,Yeruva,52_many,tumba,tumba,t u m b a,,KolipakamFW,,False,^ t u m b a $,default,t u m b a,a b m t u
1094,Koya-52_many-1,1086,Koya,52_many,tʃa:la,tʃa:la,tʃ aː l a,,KolipakamFW,,False,^ tʃ a: l a $,default,tS a l a,a l tS
1095,Telugu-52_many-2,1087,Telugu,52_many,tʃa:la,tʃa:la,tʃ aː l a,,KolipakamFW,,False,^ tʃ a: l a $,default,tS a l a,a l tS
1096,Koya-52_many-2,1088,Koya,52_many,betʃtʃo:ko,betʃtʃo:ko,b e tʃː oː k o,,KolipakamFW,,False,^ b e tʃtʃ o: k o $,default,b e tS o k o,b e k o tS
1097,Badga-52_many-1,1089,Badga,52_many,appaɾa,appaɾa,a pː a ɾ a,,KolipakamFW,,False,^ a pp a ɾ a $,default,a p a r a,a p r
1098,Malayalam-52_many-2,1090,Malayalam,52_many,ottiɾi,ottiɾi,o tː i ɾ i,,KolipakamFW,,False,^ o tt i ɾ i $,default,o t i r i,i o r t
1099,Tamil-52_many-2,1091,Tamil,52_many,neɾija,neɾija,n e ɾ i j a,,KolipakamFW,,False,^ n e ɾ i j a $,default,n e r i y a,a e i n r y
1100,Toda-52_many-1,1092,Toda,52_many,uppu:m,uppu:m,u pː uː m,,KolipakamFW,,False,^ u pp u: m $,default,u p u m,m p u
1101,Tulu-52_many-1,1093,Tulu,52_many,ba:ɾi,ba:ɾi,b aː ɾ i,,KolipakamFW,,False,^ b a: ɾ i $,default,b a r i,a b i r
1102,Betta_Kurumba-52_many-1,1094,Betta_Kurumba,52_many,kajɾijə,kajɾijə,k a j ɾ i j ə,,KolipakamFW,,False,^ k a j ɾ i j ə $,default,k a y r i y 3,3 a i k r y
1103,Kolami-52_many-1,1095,Kolami,52_many,peɾe,peɾe,p e ɾ e,,KolipakamFW,,False,^ p e ɾ e $,default,p e r e,e p r
1104,Brahui-52_many-1,1096,Brahui,52_many,ba:z,ba:z,b aː z,,KolipakamFW,,False,^ b a: z $,default,b a z,a b z
1105,Malto-52_many-1,1097,Malto,52_many,di:kehi,di:kehi,d iː k e h i,,KolipakamFW,,False,^ d i: k e h i $,default,d i k e h i,d e h i k
1106,Malto-52_many-2,1098,Malto,52_many,ga:ɖehi,ga:ɖehi,g aː ɖ e h i,,KolipakamFW,,False,^ g a: ɖ e h i $,default,g a d e h i,a d e g h i
1107,Kurukh-52_many-1,1099,Kurukh,52_many,bagge,bagge,b a gː e,,KolipakamFW,,False,^ b a gg e $,default,b a g e,a b e g
1108,Gondi-52_many-1,1100,Gondi,52_many,dʒa:sta,dʒa:sta,dʒ aː s t a,,KolipakamFW,,False,^ dʒ a: s t a $,default,dZ a s t a,a dZ s t
1109,Gondi-52_many-2,1101,Gondi,52_many,ʋellen,ʋellen,ʋ e lː e n,,KolipakamFW,,False,^ ʋ e ll e n $,default,v e l e n,e l n v
1110,Kota-52_many-1,1102,Kota,52_many,i:dʒo:ɖ,i:dʒo:ɖ,iː dʒ oː ɖ,,KolipakamFW,,False,^ i: dʒ o: ɖ $,default,i dZ o d,d dZ i o
1111,Kodava-53_meat-1,1103,Kodava,53_meat,eɾatʃi,eɾatʃi,e ɾ a tʃ i,,KolipakamFW,,False,^ e ɾ a tʃ i $,default,e r a tS i,a e i r tS
1112,Malayalam-53_meat-1,1104,Malayalam,53_meat,iɾatʃi,iɾatʃi,i ɾ a tʃ i,,KolipakamFW,,False,^ i ɾ a tʃ i $,default,i r a tS i,a i r tS
1113,Tamil-53_meat-1,1105,Tamil,53_meat,iṟaicci,iṟaicci,i r̪ a i c c i,,Andronov1964,,False,^ i ṟ a i c c i $,default,i r a i T T i,T a i r
1114,Yeruva-53_meat-1,1106,Yeruva,53_meat,iɾatʃi,iɾatʃi,i ɾ a tʃ i,,KolipakamFW,,False,^ i ɾ a tʃ i $,default,i r a tS i,a i r tS
1115,Kannada-53_meat-1,1107,Kannada,53_meat,bāḍu,bāḍu,b aː ɖ u,,Andronov1964,,False,^ b ā ḍ u $,default,b a d u,a b d u
1116,Kannada-53_meat-2,1108,Kannada,53_meat,ma:msa,ma:msa,m aː m s a,LOAN,KolipakamFW,,True,^ m a: m s a $,default,m a m s a,a m s
1117,Malayalam-53_meat-2,1109,Malayalam,53_meat,ma:msam,ma:msam,m aː m s a m,LOAN,KolipakamFW,,True,^ m a: m s a m $,default,m a m s a m,a m s
1118,Telugu-53_meat-1,1110,Telugu,53_meat,ma:msamu,ma:msamu,m aː m s a m u,LOAN,KolipakamFW,,True,^ m a: m s a m u $,default,m a m s a m u,a m s u
1119,Tulu-53_meat-1,1111,Tulu,53_meat,ma:sa,ma:sa,m aː s a,LOAN,KolipakamFW,,True,^ m a: s a $,default,m a s a,a m s
1120,Tamil-53_meat-2,1112,Tamil,53_meat,kaɾi,kaɾi,k a ɾ i,,KolipakamFW,,False,^ k a ɾ i $,default,k a r i,a i k r
1121,Kota-53_meat-1,1113,Kota,53_meat,podu,podu,p o d u,,KolipakamFW,,False,^ p o d u $,default,p o d u,d o p u
1122,Toda-53_meat-1,1114,Toda,53_meat,pi:t,pi:t,p iː t,,KolipakamFW,,False,^ p i: t $,default,p i t,i p t
1123,Badga-53_meat-1,1115,Badga,53_meat,pa:ɖə,pa:ɖə,p aː ɖ ə,,KolipakamFW,,False,^ p a: ɖ ə $,default,p a d 3,3 a d p
1124,Badga-53_meat-2,1116,Badga,53_meat,pa:gə,pa:gə,p aː g ə,,KolipakamFW,,False,^ p a: g ə $,default,p a g 3,3 a g p
1125,Koya-53_meat-1,1117,Koya,53_meat,angi:,angi:,a n g iː,,KolipakamFW,,False,^ a n g i: $,default,a n g i,a g i n
1126,Betta_Kurumba-53_meat-1,1118,Betta_Kurumba,53_meat,/əɾsi/[wəɾsi],əɾsi,ə ɾ s i,,KolipakamFW,,False,^ ə ɾ s i $,default,3 r s i,3 i r s
1127,Brahui-53_meat-1,1119,Brahui,53_meat,su:,su:,s uː,,KolipakamFW,,False,^ s u: $,default,s u,s u
1128,Gondi-53_meat-1,1120,Gondi,53_meat,haʋʋi,haʋʋi,h a ʋː i,,KolipakamFW,,False,^ h a ʋʋ i $,default,h a v i,a h i v
1129,Kolami-53_meat-1,1121,Kolami,53_meat,muɾija,muɾija,m u ɾ i j a,,KolipakamFW,,False,^ m u ɾ i j a $,default,m u r i y a,a i m r u y
1130,Malto-53_meat-1,1122,Malto,53_meat,ma:kɖu,ma:kɖu,m aː k ɖ u,,KolipakamFW,,False,^ m a: k ɖ u $,default,m a k d u,a d k m u
1131,Kurukh-53_meat-1,1123,Kurukh,53_meat,ahɖa:,ahɖa:,a h ɖ aː,,KolipakamFW,,False,^ a h ɖ a: $,default,a h d a,a d h
1132,Kota-53_meat-2,1124,Kota,53_meat,keteɾi,keteɾi,k e t e ɾ i,,KolipakamFW,,False,^ k e t e ɾ i $,default,k e t e r i,e i k r t
1133,Badga-54_moon-1,1125,Badga,54_moon,tinguʋa,tinguʋa,t i n g u ʋ a,LOAN,KolipakamFW,,True,^ t i n g u ʋ a $,default,t i n g u v a,a g i n t u v
1134,Kannada-54_moon-1,1126,Kannada,54_moon,candra,candra,c a n d r a,LOAN,Andronov1964,,True,^ c a n d r a $,default,T a n d r a,T a d n r
1135,Kannada-54_moon-2,1127,Kannada,54_moon,tʃendɾa,tʃendɾa,tʃ e n d ɾ a,LOAN,KolipakamFW,,True,^ tʃ e n d ɾ a $,default,tS e n d r a,a d e n r tS
1136,Kodava-54_moon-1,1128,Kodava,54_moon,tʃendɾa,tʃendɾa,tʃ e n d ɾ a,LOAN,KolipakamFW,,True,^ tʃ e n d ɾ a $,default,tS e n d r a,a d e n r tS
1137,Koya-54_moon-1,1129,Koya,54_moon,sanɖama:ma,sanɖama:ma,s a n ɖ a m aː m a,LOAN,KolipakamFW,,True,^ s a n ɖ a m a: m a $,default,s a n d a m a m a,a d m n s
1138,Kurukh-54_moon-1,1130,Kurukh,54_moon,tʃando,tʃando,tʃ a n d o,LOAN,KolipakamFW,,True,^ tʃ a n d o $,default,tS a n d o,a d n o tS
1139,Malayalam-54_moon-1,1131,Malayalam,54_moon,tʃendɾan,tʃendɾan,tʃ e n d ɾ a n,LOAN,KolipakamFW,,True,^ tʃ e n d ɾ a n $,default,tS e n d r a n,a d e n r tS
1140,Tamil-54_moon-1,1132,Tamil,54_moon,cantiraṉ,cantiraṉ,c a n t i r a n̪,LOAN,Andronov1964,,True,^ c a n t i r a ṉ $,default,T a n t i r a 4,4 T a i n r t
1141,Telugu-54_moon-1,1133,Telugu,54_moon,tʃendɾuɖu,tʃendɾuɖu,tʃ e n d ɾ u ɖ u,LOAN,KolipakamFW,,True,^ tʃ e n d ɾ u ɖ u $,default,tS e n d r u d u,d e n r tS u
1142,Tulu-54_moon-1,1134,Tulu,54_moon,tʃendɾe,tʃendɾe,tʃ e n d ɾ e,LOAN,KolipakamFW,,True,^ tʃ e n d ɾ e $,default,tS e n d r e,d e n r tS
1143,Kolami-54_moon-1,1135,Kolami,54_moon,nela,nela,n e l a,,KolipakamFW,,False,^ n e l a $,default,n e l a,a e l n
1144,Kota-54_moon-1,1136,Kota,54_moon,nelavə,nelavə,n e l a v ə,,KolipakamFW,,False,^ n e l a v ə $,default,n e l a v 3,3 a e l n v
1145,Koya-54_moon-2,1137,Koya,54_moon,nella,nella,n e lː a,,KolipakamFW,,False,^ n e ll a $,default,n e l a,a e l n
1146,Kuwi-54_moon-1,1138,Kuwi,54_moon,lendʒu,lendʒu,l e n dʒ u,,KolipakamFW,,False,^ l e n dʒ u $,default,l e n dZ u,dZ e l n u
1147,Ollari_Gadba-54_moon-1,1139,Ollari_Gadba,54_moon,neling,neling,n e l i n g,,KolipakamFW,,False,^ n e l i n g $,default,n e l i n g,e g i l n
1148,Parji-54_moon-1,1140,Parji,54_moon,neliñ,neliñ,n e l i ɲ,,Andronov1964,,False,^ n e l i ñ $,default,n e l i 5,5 e i l n
1149,Tamil-54_moon-2,1141,Tamil,54_moon,nila,nila,n i l a,,KolipakamFW,,False,^ n i l a $,default,n i l a,a i l n
1150,Toda-54_moon-1,1142,Toda,54_moon,nila,nila,n i l a,,KolipakamFW,,False,^ n i l a $,default,n i l a,a i l n
1151,Yeruva-54_moon-1,1143,Yeruva,54_moon,nilatʃi,nilatʃi,n i l a tʃ i,,KolipakamFW,,False,^ n i l a tʃ i $,default,n i l a tS i,a i l n tS
1152,Betta_Kurumba-54_moon-1,1144,Betta_Kurumba,54_moon,pəɾi,pəɾi,p ə ɾ i,,KolipakamFW,,False,^ p ə ɾ i $,default,p 3 r i,3 i p r
1153,Malto-54_moon-1,1145,Malto,54_moon,bilpdu,bilpdu,b i l p d u,,KolipakamFW,,False,^ b i l p d u $,default,b i l p d u,b d i l p u
1154,Brahui-54_moon-1,1146,Brahui,54_moon,ʈu:be,ʈu:be,ʈ uː b e,,KolipakamFW,,False,^ ʈ u: b e $,default,t u b e,b e t u
1155,Gondi-54_moon-1,1147,Gondi,54_moon,dʒango,dʒango,dʒ a n g o,,KolipakamFW,,False,^ dʒ a n g o $,default,dZ a n g o,a dZ g n o
1156,Kota-54_moon-2,1148,Kota,54_moon,una:ʋə,una:ʋə,u n aː ʋ ə,,KolipakamFW,,False,^ u n a: ʋ ə $,default,u n a v 3,3 a n u v
1157,Koya-55_mountain-1,1149,Koya,55_mountain,gubal,gubal,g u b a l,,KolipakamFW,,False,^ g u b a l $,default,g u b a l,a b g l u
1158,Betta_Kurumba-55_mountain-1,1150,Betta_Kurumba,55_mountain,bəʈʈə,bəʈʈə,b ə ʈː ə,,KolipakamFW,,False,^ b ə ʈʈ ə $,default,b 3 t 3,3 b t
1159,Kannada-55_mountain-1,1151,Kannada,55_mountain,beʈʈa,beʈʈa,b e ʈː a,,Andronov1964,,False,^ b e ʈʈ a $,default,b e t a,a b e t
1160,Kodava-55_mountain-1,1152,Kodava,55_mountain,kundə,kundə,k u n d ə,,KolipakamFW,,False,^ k u n d ə $,default,k u n d 3,3 d k n u
1161,Telugu-55_mountain-1,1153,Telugu,55_mountain,konɖa,konɖa,k o n ɖ a,,KolipakamFW,,False,^ k o n ɖ a $,default,k o n d a,a d k n o
1162,Yeruva-55_mountain-1,1154,Yeruva,55_mountain,kundə,kundə,k u n d ə,,KolipakamFW,,False,^ k u n d ə $,default,k u n d 3,3 d k n u
1163,Badga-55_mountain-1,1155,Badga,55_mountain,male,male,m a l e,,KolipakamFW,,False,^ m a l e $,default,m a l e,a e l m
1164,Brahui-55_mountain-1,1156,Brahui,55_mountain,maʃ,maʃ,m a ʃ,,KolipakamFW,,False,^ m a ʃ $,default,m a S,S a m
1165,Malayalam-55_mountain-1,1157,Malayalam,55_mountain,mala,mala,m a l a,,Andronov1964,,False,^ m a l a $,default,m a l a,a l m
1166,Tamil-55_mountain-1,1158,Tamil,55_mountain,malai,malai,m a l a i,,Andronov1964,,False,^ m a l a i $,default,m a l a i,a i l m
1167,Gondi-55_mountain-1,1159,Gondi,55_mountain,meʈʈa,meʈʈa,m e ʈː a,,KolipakamFW,,False,^ m e ʈʈ a $,default,m e t a,a e m t
1168,Koya-55_mountain-2,1160,Koya,55_mountain,meʈʈa,meʈʈa,m e ʈː a,,KolipakamFW,,False,^ m e ʈʈ a $,default,m e t a,a e m t
1169,Malayalam-55_mountain-2,1161,Malayalam,55_mountain,paɾʋatam,paɾʋatam,p a ɾ ʋ a t a m,LOAN,KolipakamFW,,True,^ p a ɾ ʋ a t a m $,default,p a r v a t a m,a m p r t v
1170,Telugu-55_mountain-2,1162,Telugu,55_mountain,paɾʋatamu,paɾʋatamu,p a ɾ ʋ a t a m u,LOAN,KolipakamFW,,True,^ p a ɾ ʋ a t a m u $,default,p a r v a t a m u,a m p r t u v
1171,Toda-55_mountain-1,1163,Toda,55_mountain,tiʈʈə,tiʈʈə,t i ʈː ə,,KolipakamFW,,False,^ t i ʈʈ ə $,default,t i t 3,3 i t
1172,Tulu-55_mountain-1,1164,Tulu,55_mountain,da:ɾi,da:ɾi,d aː ɾ i,,KolipakamFW,,False,^ d a: ɾ i $,default,d a r i,a d i r
1173,Malto-55_mountain-1,1165,Malto,55_mountain,be:ɖo paha:ɖi,be:ɖo paha:ɖi,b eː ɖ o + p a h aː ɖ i,,KolipakamFW,,False,^ b e: ɖ o + p a h a: ɖ i $,default,b e d o  p a h a d i, a b d e h i o p
1174,Kurukh-55_mountain-1,1166,Kurukh,55_mountain,paɾta,paɾta,p a ɾ t a,,KolipakamFW,,False,^ p a ɾ t a $,default,p a r t a,a p r t
1175,Kolami-55_mountain-1,1167,Kolami,55_mountain,danɖime:ʈ,danɖime:ʈ,d a n ɖ i m eː ʈ,,KolipakamFW,,False,^ d a n ɖ i m e: ʈ $,default,d a n d i m e t,a d e i m n t
1176,Kota-55_mountain-1,1168,Kota,55_mountain,ʋe:ʈume,ʋe:ʈume,ʋ eː ʈ u m e,,KolipakamFW,,False,^ ʋ e: ʈ u m e $,default,v e t u m e,e m t u v
1177,Ollari_Gadba-55_mountain-1,1169,Ollari_Gadba,55_mountain,kappe,kappe,k a pː e,,KolipakamFW,,False,^ k a pp e $,default,k a p e,a e k p
1178,Betta_Kurumba-56_mouth-1,1170,Betta_Kurumba,56_mouth,ba:jə,ba:jə,b aː j ə,,KolipakamFW,,False,^ b a: j ə $,default,b a y 3,3 a b y
1179,Brahui-56_mouth-1,1171,Brahui,56_mouth,ba:,ba:,b aː,,KolipakamFW,,False,^ b a: $,default,b a,a b
1180,Kannada-56_mouth-1,1172,Kannada,56_mouth,ba:ji,ba:ji,b aː j i,,KolipakamFW,,False,^ b a: j i $,default,b a y i,a b i y
1181,Kodava-56_mouth-1,1173,Kodava,56_mouth,ba:ji,ba:ji,b aː j i,,KolipakamFW,,False,^ b a: j i $,default,b a y i,a b i y
1182,Kota-56_mouth-1,1174,Kota,56_mouth,ʋa:ji,ʋa:ji,ʋ aː j i,,KolipakamFW,,False,^ ʋ a: j i $,default,v a y i,a i v y
1183,Kurukh-56_mouth-1,1175,Kurukh,56_mouth,baji,baji,b a j i,,KolipakamFW,,False,^ b a j i $,default,b a y i,a b i y
1184,Malayalam-56_mouth-1,1176,Malayalam,56_mouth,ʋa:ja,ʋa:ja,ʋ aː j a,,KolipakamFW,,False,^ ʋ a: j a $,default,v a y a,a v y
1185,Parji-56_mouth-1,1177,Parji,56_mouth,vāy,vāy,v aː y,,Andronov1964,,False,^ v ā y $,default,v a i,a i v
1186,Tamil-56_mouth-1,1178,Tamil,56_mouth,ʋa:ji,ʋa:ji,ʋ aː j i,,Andronov1964,,False,^ ʋ a: j i $,default,v a y i,a i v y
1187,Tamil-56_mouth-2,1179,Tamil,56_mouth,ʋa:,ʋa:,ʋ aː,,KolipakamFW,,False,^ ʋ a: $,default,v a,a v
1188,Toda-56_mouth-1,1180,Toda,56_mouth,po:i,po:i,p oː i,,KolipakamFW,,False,^ p o: i $,default,p o i,i o p
1189,Tulu-56_mouth-1,1181,Tulu,56_mouth,ba:ji,ba:ji,b aː j i,,KolipakamFW,,False,^ b a: j i $,default,b a y i,a b i y
1190,Yeruva-56_mouth-1,1182,Yeruva,56_mouth,ba:ji,ba:ji,b aː j i,,KolipakamFW,,False,^ b a: j i $,default,b a y i,a b i y
1191,Telugu-56_mouth-1,1183,Telugu,56_mouth,no:ɾu,no:ɾu,n oː ɾ u,,KolipakamFW,,False,^ n o: ɾ u $,default,n o r u,n o r u
1192,Koya-56_mouth-1,1184,Koya,56_mouth,pavu:ɾ,pavu:ɾ,p a v uː ɾ,,KolipakamFW,,False,^ p a v u: ɾ $,default,p a v u r,a p r u v
1193,Badga-56_mouth-1,1185,Badga,56_mouth,pe,pe,p e,,KolipakamFW,,False,^ p e $,default,p e,e p
1194,Gondi-56_mouth-1,1186,Gondi,56_mouth,toɖɖi,toɖɖi,t o ɖː i,,KolipakamFW,,False,^ t o ɖɖ i $,default,t o d i,d i o t
