,ID,Local_ID,Language_ID,Parameter_ID,Value,Form,Segments,Comment,Source,Cognacy,Loan,Graphemes,Profile,asjp_forms,asjp_segs
1593,Malayalam-76_sleep-1,1581,Malayalam,76_sleep,uɾanguga,uɾanguga,u ɾ a n g u g a,,Andronov1964,,False,^ u ɾ a n g u g a $,default,u r a n g u g a,a g n r u
1594,Tamil-76_sleep-1,1582,Tamil,76_sleep,uṟaṅku-,uṟaṅku-,u r̪ a ŋ k u,,Andronov1964,,False,^ u ṟ a ṅ k u -$,default,u r a N k u,N a k r u
1595,Toda-76_sleep-1,1583,Toda,76_sleep,oɾkʰə,oɾkʰə,o ɾ kʰ ə,,KolipakamFW,,False,^ o ɾ kʰ ə $,default,o r kh~ 3,3 kh~ o r
1596,Yeruva-76_sleep-1,1584,Yeruva,76_sleep,oɾa,oɾa,o ɾ a,,KolipakamFW,,False,^ o ɾ a $,default,o r a,a o r
1597,Kannada-76_sleep-1,1585,Kannada,76_sleep,malagu-,malagu-,m a l a g u,,Andronov1964,,False,^ m a l a g u -$,default,m a l a g u,a g l m u
1598,Kannada-76_sleep-2,1586,Kannada,76_sleep,nidriso,nidriso,n i d r i s o,LOAN,KolipakamFW,,True,^ n i d r i s o $,default,n i d r i s o,d i n o r s
1599,Telugu-76_sleep-1,1587,Telugu,76_sleep,nidɾapoʋu,nidɾapoʋu,n i d ɾ a p o ʋ u,LOAN,KolipakamFW,,True,^ n i d ɾ a p o ʋ u $,default,n i d r a p o v u,a d i n o p r u v
1600,Gondi-76_sleep-1,1588,Gondi,76_sleep,mi:ɳɖa,mi:ɳɖa,m iː ɳ ɖ a,,KolipakamFW,,False,^ m i: ɳ ɖ a $,default,m i n d a,a d i m n
1601,Parji-76_sleep-1,1589,Parji,76_sleep,maḍ-,maḍ-,m a ɖ,,Andronov1964,,False,^ m a ḍ -$,default,m a d,a d m
1602,Kurukh-76_sleep-1,1590,Kurukh,76_sleep,khandaɾna,khandaɾna,k h a n d a ɾ n a,,KolipakamFW,,False,^ k h a n d a ɾ n a $,default,k h a n d a r n a,a d h k n r
1603,Malto-76_sleep-1,1591,Malto,76_sleep,andaɾpo ko:ɖa,andaɾpo ko:ɖa,a n d a ɾ p o + k oː ɖ a,,KolipakamFW,,False,^ a n d a ɾ p o + k o: ɖ a $,default,a n d a r p o  k o d a, a d k n o p r
1604,Tamil-76_sleep-2,1592,Tamil,76_sleep,tu:ngə,tu:ngə,t uː n g ə,,KolipakamFW,,False,^ t u: n g ə $,default,t u n g 3,3 g n t u
1605,Koya-76_sleep-1,1593,Koya,76_sleep,undʒaʈam,undʒaʈam,u n dʒ a ʈ a m,,KolipakamFW,,False,^ u n dʒ a ʈ a m $,default,u n dZ a t a m,a dZ m n t u
1606,Tulu-76_sleep-1,1594,Tulu,76_sleep,dʒippaɾa,dʒippaɾa,dʒ i pː a ɾ a,,KolipakamFW,,False,^ dʒ i pp a ɾ a $,default,dZ i p a r a,a dZ i p r
1607,Kolami-76_sleep-1,1595,Kolami,76_sleep,i:mangsati,i:mangsati,iː m a n g s a t i,,KolipakamFW,,False,^ i: m a n g s a t i $,default,i m a n g s a t i,a g i m n s t
1608,Brahui-76_sleep-1,1596,Brahui,76_sleep,xatʃing,xatʃing,x a tʃ i n g,,KolipakamFW,,False,^ x a tʃ i n g $,default,x a tS i n g,a g i n tS x
1609,Malto-76_sleep-2,1597,Malto,76_sleep,anəa,anəa,a n ə a,,KolipakamFW,,False,^ a n ə a $,default,a n 3 a,3 a n
1610,Kodava-77_small-1,1598,Kodava,77_small,tʃeɾijadə,tʃeɾijadə,tʃ e ɾ i j a d ə,,KolipakamFW,,False,^ tʃ e ɾ i j a d ə $,default,tS e r i y a d 3,3 a d e i r tS y
1611,Malayalam-77_small-1,1599,Malayalam,77_small,tʃeɾija,tʃeɾija,tʃ e ɾ i j a,,KolipakamFW,,False,^ tʃ e ɾ i j a $,default,tS e r i y a,a e i r tS y
1612,Tamil-77_small-1,1600,Tamil,77_small,ciṟiya,ciṟiya,c i r̪ i y a,,Andronov1964,,False,^ c i ṟ i y a $,default,T i r i i a,T a i r
1613,Yeruva-77_small-1,1601,Yeruva,77_small,tʃeɾija,tʃeɾija,tʃ e ɾ i j a,,KolipakamFW,,False,^ tʃ e ɾ i j a $,default,tS e r i y a,a e i r tS y
1614,Kannada-77_small-1,1602,Kannada,77_small,tʃikkadu,tʃikkadu,tʃ i kː a d u,,KolipakamFW,,False,^ tʃ i kk a d u $,default,tS i k a d u,a d i k tS u
1615,Brahui-77_small-1,1603,Brahui,77_small,tʃunak,tʃunak,tʃ u n a k,,KolipakamFW,,False,^ tʃ u n a k $,default,tS u n a k,a k n tS u
1616,Gondi-77_small-1,1604,Gondi,77_small,tʃinna,tʃinna,tʃ i nː a,,KolipakamFW,,False,^ tʃ i nn a $,default,tS i n a,a i n tS
1617,Kolami-77_small-1,1605,Kolami,77_small,sinna,sinna,s i nː a,,KolipakamFW,,False,^ s i nn a $,default,s i n a,a i n s
1618,Koya-77_small-1,1606,Koya,77_small,tʃinnad,tʃinnad,tʃ i nː a d,,KolipakamFW,,False,^ tʃ i nn a d $,default,tS i n a d,a d i n tS
1619,Kurukh-77_small-1,1607,Kurukh,77_small,sanni,sanni,s a nː i,,KolipakamFW,,False,^ s a nn i $,default,s a n i,a i n s
1620,Parji-77_small-1,1608,Parji,77_small,cin,cin,c i n,,Andronov1964,,False,^ c i n $,default,T i n,T i n
1621,Tamil-77_small-2,1609,Tamil,77_small,tʃinna,tʃinna,tʃ i nː a,,KolipakamFW,,False,^ tʃ i nn a $,default,tS i n a,a i n tS
1622,Telugu-77_small-1,1610,Telugu,77_small,tʃinna,tʃinna,tʃ i nː a,,KolipakamFW,,False,^ tʃ i nn a $,default,tS i n a,a i n tS
1623,Tulu-77_small-1,1611,Tulu,77_small,kiɲa,kiɲa,k i ɲ a,,KolipakamFW,,False,^ k i ɲ a $,default,k i 5 a,5 a i k
1624,Badga-77_small-1,1612,Badga,77_small,kunnadə,kunnadə,k u nː a d ə,,KolipakamFW,,False,^ k u nn a d ə $,default,k u n a d 3,3 a d k n u
1625,Badga-77_small-2,1613,Badga,77_small,kiʈʈi:ʈ,kiʈʈi:ʈ,k i ʈː iː ʈ,,KolipakamFW,,False,^ k i ʈʈ i: ʈ $,default,k i t i t,i k t
1626,Betta_Kurumba-77_small-1,1614,Betta_Kurumba,77_small,kiɾi,kiɾi,k i ɾ i,,KolipakamFW,,False,^ k i ɾ i $,default,k i r i,i k r
1627,Toda-77_small-1,1615,Toda,77_small,ke:ɾu:ɖə,ke:ɾu:ɖə,k eː ɾ uː ɖ ə,,KolipakamFW,,False,^ k e: ɾ u: ɖ ə $,default,k e r u d 3,3 d e k r u
1628,Malto-77_small-1,1616,Malto,77_small,ɾikʋa:di,ɾikʋa:di,ɾ i k ʋ aː d i,,KolipakamFW,,False,^ ɾ i k ʋ a: d i $,default,r i k v a d i,a d i k r v
1629,Malto-77_small-2,1617,Malto,77_small,saɾʋe,saɾʋe,s a ɾ ʋ e,,KolipakamFW,,False,^ s a ɾ ʋ e $,default,s a r v e,a e r s v
1630,Kota-77_small-1,1618,Kota,77_small,guntə,guntə,g u n t ə,,KolipakamFW,,False,^ g u n t ə $,default,g u n t 3,3 g n t u
1631,Ollari_Gadba-77_small-1,1619,Ollari_Gadba,77_small,kande:k,kande:k,k a n d eː k,,KolipakamFW,,False,^ k a n d e: k $,default,k a n d e k,a d e k n
1632,Badga-78_smoke-1,1620,Badga,78_smoke,hoge,hoge,h o g e,,KolipakamFW,,False,^ h o g e $,default,h o g e,e g h o
1633,Betta_Kurumba-78_smoke-1,1621,Betta_Kurumba,78_smoke,pəggi,pəggi,p ə gː i,,KolipakamFW,,False,^ p ə gg i $,default,p 3 g i,3 g i p
1634,Gondi-78_smoke-1,1622,Gondi,78_smoke,poja,poja,p o j a,,KolipakamFW,,False,^ p o j a $,default,p o y a,a o p y
1635,Kannada-78_smoke-1,1623,Kannada,78_smoke,hoge,hoge,h o g e,,KolipakamFW,,False,^ h o g e $,default,h o g e,e g h o
1636,Kodava-78_smoke-1,1624,Kodava,78_smoke,poge,poge,p o g e,,KolipakamFW,,False,^ p o g e $,default,p o g e,e g o p
1637,Kolami-78_smoke-1,1625,Kolami,78_smoke,pog,pog,p o g,,KolipakamFW,,False,^ p o g $,default,p o g,g o p
1638,Kota-78_smoke-1,1626,Kota,78_smoke,pegu,pegu,p e g u,,KolipakamFW,,False,^ p e g u $,default,p e g u,e g p u
1639,Malayalam-78_smoke-1,1627,Malayalam,78_smoke,puka,puka,p u k a,,KolipakamFW,,False,^ p u k a $,default,p u k a,a k p u
1640,Ollari_Gadba-78_smoke-1,1628,Ollari_Gadba,78_smoke,poa:g,poa:g,p o aː g,,KolipakamFW,,False,^ p o a: g $,default,p o a g,a g o p
1641,Tamil-78_smoke-1,1629,Tamil,78_smoke,pukai,pukai,p u k a i,,Andronov1964,,False,^ p u k a i $,default,p u k a i,a i k p u
1642,Tamil-78_smoke-2,1630,Tamil,78_smoke,pugai,pugai,p u g a i,,KolipakamFW,,False,^ p u g a i $,default,p u g a i,a g i p u
1643,Telugu-78_smoke-1,1631,Telugu,78_smoke,poga,poga,p o g a,,KolipakamFW,,False,^ p o g a $,default,p o g a,a g o p
1644,Toda-78_smoke-1,1632,Toda,78_smoke,pukuɖti,pukuɖti,p u k u ɖ t i,,KolipakamFW,,False,^ p u k u ɖ t i $,default,p u k u d t i,d i k p t u
1645,Tulu-78_smoke-1,1633,Tulu,78_smoke,poga,poga,p o g a,,KolipakamFW,,False,^ p o g a $,default,p o g a,a g o p
1646,Yeruva-78_smoke-1,1634,Yeruva,78_smoke,poge,poge,p o g e,,KolipakamFW,,False,^ p o g e $,default,p o g e,e g o p
1647,Koya-78_smoke-1,1635,Koya,78_smoke,kumpo:ɖ,kumpo:ɖ,k u m p oː ɖ,,KolipakamFW,,False,^ k u m p o: ɖ $,default,k u m p o d,d k m o p u
1648,Brahui-78_smoke-1,1636,Brahui,78_smoke,mo:ʃ,mo:ʃ,m oː ʃ,,KolipakamFW,,False,^ m o: ʃ $,default,m o S,S m o
1649,Kurukh-78_smoke-1,1637,Kurukh,78_smoke,mosaga,mosaga,m o s a g a,,KolipakamFW,,False,^ m o s a g a $,default,m o s a g a,a g m o s
1650,Malto-78_smoke-1,1638,Malto,78_smoke,mo:ha,mo:ha,m oː h a,,KolipakamFW,,False,^ m o: h a $,default,m o h a,a h m o
1651,Badga-79_stand-1,1639,Badga,79_stand,nippə,nippə,n i pː ə,,KolipakamFW,,False,^ n i pp ə $,default,n i p 3,3 i n p
1652,Gondi-79_stand-1,1640,Gondi,79_stand,nil,nil,n i l,,KolipakamFW,,False,^ n i l $,default,n i l,i l n
1653,Kannada-79_stand-1,1641,Kannada,79_stand,nintiko,nintiko,n i n t i k o,,KolipakamFW,,False,^ n i n t i k o $,default,n i n t i k o,i k n o t
1654,Kodava-79_stand-1,1642,Kodava,79_stand,nində,nində,n i n d ə,,KolipakamFW,,False,^ n i n d ə $,default,n i n d 3,3 d i n
1655,Kolami-79_stand-1,1643,Kolami,79_stand,ni:ma:n,ni:ma:n,n iː m aː n,,KolipakamFW,,False,^ n i: m a: n $,default,n i m a n,a i m n
1656,Kota-79_stand-1,1644,Kota,79_stand,ninnatukə,ninnatukə,n i nː a t u k ə,,KolipakamFW,,False,^ n i nn a t u k ə $,default,n i n a t u k 3,3 a i k n t u
1657,Koya-79_stand-1,1645,Koya,79_stand,nilla,nilla,n i lː a,,KolipakamFW,,False,^ n i ll a $,default,n i l a,a i l n
1658,Koya-79_stand-2,1646,Koya,79_stand,nilliman,nilliman,n i lː i m a n,,KolipakamFW,,False,^ n i ll i m a n $,default,n i l i m a n,a i l m n
1659,Kurukh-79_stand-1,1647,Kurukh,79_stand,idʒdʒna,idʒdʒna,i dʒː n a,,KolipakamFW,,False,^ i dʒdʒ n a $,default,i dZ n a,a dZ i n
1660,Malayalam-79_stand-1,1648,Malayalam,79_stand,nilkuga,nilkuga,n i l k u g a,,Andronov1964,,False,^ n i l k u g a $,default,n i l k u g a,a g i k l n u
1661,Malto-79_stand-1,1649,Malto,79_stand,hilpo,hilpo,h i l p o,,KolipakamFW,,False,^ h i l p o $,default,h i l p o,h i l o p
1662,Parji-79_stand-1,1650,Parji,79_stand,nilp-,nilp-,n i l p,,Andronov1964,,False,^ n i l p -$,default,n i l p,i l n p
1663,Tamil-79_stand-1,1651,Tamil,79_stand,nil,nil,n i l,,Andronov1964,,False,^ n i l $,default,n i l,i l n
1664,Telugu-79_stand-1,1652,Telugu,79_stand,niltʃonu,niltʃonu,n i l tʃ o n u,,KolipakamFW,,False,^ n i l tʃ o n u $,default,n i l tS o n u,i l n o tS u
1665,Telugu-79_stand-2,1653,Telugu,79_stand,nilabaɖu,nilabaɖu,n i l a b a ɖ u,,KolipakamFW,,False,^ n i l a b a ɖ u $,default,n i l a b a d u,a b d i l n u
1666,Yeruva-79_stand-1,1654,Yeruva,79_stand,nindʒo,nindʒo,n i n dʒ o,,KolipakamFW,,False,^ n i n dʒ o $,default,n i n dZ o,dZ i n o
1667,Betta_Kurumba-79_stand-1,1655,Betta_Kurumba,79_stand,ə:ɭ,ə:ɭ,əː ɭ,,KolipakamFW,,False,^ ə: ɭ $,default,3 L,3 L
1668,Betta_Kurumba-79_stand-2,1656,Betta_Kurumba,79_stand,əddənu i:ɾ,əddənu i:ɾ,ə d d ə n u + iː ɾ,,KolipakamFW,,False,^ ə d d ə n u + i: ɾ $,default,3 d d 3 n u  i r, 3 d i n r u
1669,Toda-79_stand-1,1657,Toda,79_stand,mukkaɖuɾil,mukkaɖuɾil,m u kː a ɖ u ɾ i l,,KolipakamFW,,False,^ m u kk a ɖ u ɾ i l $,default,m u k a d u r i l,a d i k l m r u
1670,Tulu-79_stand-1,1658,Tulu,79_stand,untaɾa,untaɾa,u n t a ɾ a,,KolipakamFW,,False,^ u n t a ɾ a $,default,u n t a r a,a n r t u
1671,Brahui-79_stand-1,1659,Brahui,79_stand,saling,saling,s a l i n g,,KolipakamFW,,False,^ s a l i n g $,default,s a l i n g,a g i l n s
1672,Brahui-79_stand-2,1660,Brahui,79_stand,dʒe:k saling,dʒe:k saling,dʒ eː k + s a l i n g,,KolipakamFW,,False,^ dʒ e: k + s a l i n g $,default,dZ e k  s a l i n g, a dZ e g i k l n s
1673,Betta_Kurumba-80_star-1,1661,Betta_Kurumba,80_star,mi:nu,mi:nu,m iː n u,,KolipakamFW,,False,^ m i: n u $,default,m i n u,i m n u
1674,Kurukh-80_star-1,1662,Kurukh,80_star,bi:nko,bi:nko,b iː n k o,,KolipakamFW,,False,^ b i: n k o $,default,b i n k o,b i k n o
1675,Malto-80_star-1,1663,Malto,80_star,bi:nka,bi:nka,b iː n k a,,KolipakamFW,,False,^ b i: n k a $,default,b i n k a,a b i k n
1676,Tamil-80_star-1,1664,Tamil,80_star,mīṉ,mīṉ,m iː n̪,,Andronov1964;BurrowEmeneau1961,,False,^ m ī ṉ $,default,m i 4,4 i m
1677,Brahui-80_star-1,1665,Brahui,80_star,isʈa:ɾ,isʈa:ɾ,i s ʈ aː ɾ,LOAN,KolipakamFW,,True,^ i s ʈ a: ɾ $,default,i s t a r,a i r s t
1678,Badga-80_star-1,1666,Badga,80_star,natʃtʃatɾa,natʃtʃatɾa,n a tʃː a t ɾ a,LOAN,KolipakamFW,,True,^ n a tʃtʃ a t ɾ a $,default,n a tS a t r a,a n r t tS
1679,Kannada-80_star-1,1667,Kannada,80_star,nakʂatɾ,nakʂatɾ,n a k ʂ a t ɾ,LOAN,Andronov1964,,True,^ n a k ʂ a t ɾ $,default,n a k S a t r,S a k n r t
1680,Kodava-80_star-1,1668,Kodava,80_star,nakʂatɾa,nakʂatɾa,n a k ʂ a t ɾ a,LOAN,KolipakamFW,,True,^ n a k ʂ a t ɾ a $,default,n a k S a t r a,S a k n r t
1681,Kota-80_star-1,1669,Kota,80_star,nakʂaʈiɾam,nakʂaʈiɾam,n a k ʂ a ʈ i ɾ a m,LOAN,KolipakamFW,,True,^ n a k ʂ a ʈ i ɾ a m $,default,n a k S a t i r a m,S a i k m n r t
1682,Malayalam-80_star-1,1670,Malayalam,80_star,nakʂatɾam,nakʂatɾam,n a k ʂ a t ɾ a m,LOAN,KolipakamFW,,True,^ n a k ʂ a t ɾ a m $,default,n a k S a t r a m,S a k m n r t
1683,Tamil-80_star-2,1671,Tamil,80_star,natʃtʃatiɾam,natʃtʃatiɾam,n a tʃː a t i ɾ a m,LOAN,KolipakamFW,,True,^ n a tʃtʃ a t i ɾ a m $,default,n a tS a t i r a m,a i m n r t tS
1684,Telugu-80_star-1,1672,Telugu,80_star,nakʂatɾamu,nakʂatɾamu,n a k ʂ a t ɾ a m u,LOAN,KolipakamFW,,True,^ n a k ʂ a t ɾ a m u $,default,n a k S a t r a m u,S a k m n r t u
1685,Toda-80_star-1,1673,Toda,80_star,naʈtʃatiɾam,naʈtʃatiɾam,n a ʈ tʃ a t i ɾ a m,LOAN,KolipakamFW,,True,^ n a ʈ tʃ a t i ɾ a m $,default,n a t tS a t i r a m,a i m n r t tS
1686,Tulu-80_star-1,1674,Tulu,80_star,nakʂatɾe,nakʂatɾe,n a k ʂ a t ɾ e,LOAN,KolipakamFW,,True,^ n a k ʂ a t ɾ e $,default,n a k S a t r e,S a e k n r t
1687,Yeruva-80_star-1,1675,Yeruva,80_star,natʃtʃatiɾa,natʃtʃatiɾa,n a tʃː a t i ɾ a,LOAN,KolipakamFW,,True,^ n a tʃtʃ a t i ɾ a $,default,n a tS a t i r a,a i n r t tS
1688,Gondi-80_star-1,1676,Gondi,80_star,sukku,sukku,s u kː u,,KolipakamFW,,False,^ s u kk u $,default,s u k u,k s u
1689,Kolami-80_star-1,1677,Kolami,80_star,sukka,sukka,s u kː a,,KolipakamFW,,False,^ s u kk a $,default,s u k a,a k s u
1690,Koya-80_star-1,1678,Koya,80_star,ukka,ukka,u kː a,,KolipakamFW,,False,^ u kk a $,default,u k a,a k u
1691,Kuwi-80_star-1,1679,Kuwi,80_star,huka,huka,h u k a,,KolipakamFW,,False,^ h u k a $,default,h u k a,a h k u
1692,Parji-80_star-1,1680,Parji,80_star,cukka,cukka,c u kː a,,Andronov1964,,False,^ c u kk a $,default,T u k a,T a k u
1693,Telugu-80_star-2,1681,Telugu,80_star,tʃukka,tʃukka,tʃ u kː a,,KolipakamFW,,False,^ tʃ u kk a $,default,tS u k a,a k tS u
1694,Ollari_Gadba-80_star-1,1682,Ollari_Gadba,80_star,puʈ,puʈ,p u ʈ,,KolipakamFW,,False,^ p u ʈ $,default,p u t,p t u
1695,Badga-80_star-2,1683,Badga,80_star,pa:ndmi:nə,pa:ndmi:nə,p aː n d m iː n ə,,KolipakamFW,,False,^ p a: n d m i: n ə $,default,p a n d m i n 3,3 a d i m n p
1696,Badga-81_stone-1,1684,Badga,81_stone,kallə,kallə,k a lː ə,,KolipakamFW,,False,^ k a ll ə $,default,k a l 3,3 a k l
1697,Betta_Kurumba-81_stone-1,1685,Betta_Kurumba,81_stone,kallə,kallə,k a lː ə,,KolipakamFW,,False,^ k a ll ə $,default,k a l 3,3 a k l
1698,Brahui-81_stone-1,1686,Brahui,81_stone,xal,xal,x a l,,KolipakamFW,,False,^ x a l $,default,x a l,a l x
1699,Kannada-81_stone-1,1687,Kannada,81_stone,kallu,kallu,k a lː u,,Andronov1964,,False,^ k a ll u $,default,k a l u,a k l u
1700,Kannada-81_stone-2,1688,Kannada,81_stone,kallu,kallu,k a lː u,,KolipakamFW,,False,^ k a ll u $,default,k a l u,a k l u
1701,Kodava-81_stone-1,1689,Kodava,81_stone,kallə,kallə,k a lː ə,,KolipakamFW,,False,^ k a ll ə $,default,k a l 3,3 a k l
1702,Kota-81_stone-1,1690,Kota,81_stone,kal,kal,k a l,,KolipakamFW,,False,^ k a l $,default,k a l,a k l
1703,Malayalam-81_stone-1,1691,Malayalam,81_stone,kallə,kallə,k a lː ə,,KolipakamFW,,False,^ k a ll ə $,default,k a l 3,3 a k l
1704,Ollari_Gadba-81_stone-1,1692,Ollari_Gadba,81_stone,kanɖ,kanɖ,k a n ɖ,,KolipakamFW,,False,^ k a n ɖ $,default,k a n d,a d k n
1705,Parji-81_stone-1,1693,Parji,81_stone,kel,kel,k e l,,Andronov1964,,False,^ k e l $,default,k e l,e k l
1706,Tamil-81_stone-1,1694,Tamil,81_stone,kallə,kallə,k a lː ə,,Andronov1964,,False,^ k a ll ə $,default,k a l 3,3 a k l
1707,Toda-81_stone-1,1695,Toda,81_stone,kaɾs,kaɾs,k a ɾ s,,KolipakamFW,,False,^ k a ɾ s $,default,k a r s,a k r s
1708,Tulu-81_stone-1,1696,Tulu,81_stone,kallu,kallu,k a lː u,,KolipakamFW,,False,^ k a ll u $,default,k a l u,a k l u
1709,Yeruva-81_stone-1,1697,Yeruva,81_stone,kallu,kallu,k a lː u,,KolipakamFW,,False,^ k a ll u $,default,k a l u,a k l u
1710,Koya-81_stone-1,1698,Koya,81_stone,ɾa:j,ɾa:j,ɾ aː j,,KolipakamFW,,False,^ ɾ a: j $,default,r a y,a r y
1711,Telugu-81_stone-1,1699,Telugu,81_stone,ɾa:ji,ɾa:ji,ɾ aː j i,,KolipakamFW,,False,^ ɾ a: j i $,default,r a y i,a i r y
1712,Kuwi-81_stone-1,1700,Kuwi,81_stone,ʋali,ʋali,ʋ a l i,,KolipakamFW,,False,^ ʋ a l i $,default,v a l i,a i l v
1713,Gondi-81_stone-1,1701,Gondi,81_stone,baɳɖa,baɳɖa,b a ɳ ɖ a,,KolipakamFW,,False,^ b a ɳ ɖ a $,default,b a n d a,a b d n
1714,Kolami-81_stone-1,1702,Kolami,81_stone,gunɖə,gunɖə,g u n ɖ ə,,KolipakamFW,,False,^ g u n ɖ ə $,default,g u n d 3,3 d g n u
1715,Malto-81_stone-1,1703,Malto,81_stone,guga,guga,g u g a,,KolipakamFW,,False,^ g u g a $,default,g u g a,a g u
1716,Kurukh-81_stone-1,1704,Kurukh,81_stone,pakʰna,pakʰna,p a kʰ n a,,KolipakamFW,,False,^ p a kʰ n a $,default,p a kh~ n a,a kh~ n p
1717,Kannada-82_sun-1,1705,Kannada,82_sun,su:rja,su:rja,s uː r j a,LOAN,Andronov1964,,True,^ s u: r j a $,default,s u r y a,a r s u y
1718,Kodava-82_sun-1,1706,Kodava,82_sun,su:ɾja,su:ɾja,s uː ɾ j a,LOAN,KolipakamFW,,True,^ s u: ɾ j a $,default,s u r y a,a r s u y
1719,Kolami-82_sun-1,1707,Kolami,82_sun,suɾija,suɾija,s u ɾ i j a,LOAN,KolipakamFW,,True,^ s u ɾ i j a $,default,s u r i y a,a i r s u y
1720,Kota-82_sun-1,1708,Kota,82_sun,su:rijan,su:rijan,s uː r i j a n,LOAN,KolipakamFW,,True,^ s u: r i j a n $,default,s u r i y a n,a i n r s u y
1721,Malayalam-82_sun-1,1709,Malayalam,82_sun,su:ɾjan,su:ɾjan,s uː ɾ j a n,LOAN,KolipakamFW,,True,^ s u: ɾ j a n $,default,s u r y a n,a n r s u y
1722,Tamil-82_sun-1,1710,Tamil,82_sun,su:ɾjan,su:ɾjan,s uː ɾ j a n,LOAN,Andronov1964,,True,^ s u: ɾ j a n $,default,s u r y a n,a n r s u y
1723,Telugu-82_sun-1,1711,Telugu,82_sun,su:ɾjuɖu,su:ɾjuɖu,s uː ɾ j u ɖ u,LOAN,KolipakamFW,,True,^ s u: ɾ j u ɖ u $,default,s u r y u d u,d r s u y
1724,Toda-82_sun-1,1712,Toda,82_sun,su:ɾijan,su:ɾijan,s uː ɾ i j a n,LOAN,KolipakamFW,,True,^ s u: ɾ i j a n $,default,s u r i y a n,a i n r s u y
1725,Tulu-82_sun-1,1713,Tulu,82_sun,su:ɾje,su:ɾje,s uː ɾ j e,LOAN,KolipakamFW,,True,^ s u: ɾ j e $,default,s u r y e,e r s u y
1726,Yeruva-82_sun-1,1714,Yeruva,82_sun,tʃu:rja,tʃu:rja,tʃ uː r j a,LOAN,KolipakamFW,,True,^ tʃ u: r j a $,default,tS u r y a,a r tS u y
1727,Betta_Kurumba-82_sun-1,1715,Betta_Kurumba,82_sun,pottə,pottə,p o tː ə,,KolipakamFW,,False,^ p o tt ə $,default,p o t 3,3 o p t
1728,Gondi-82_sun-1,1716,Gondi,82_sun,poɾə,poɾə,p o ɾ ə,,KolipakamFW,,False,^ p o ɾ ə $,default,p o r 3,3 o p r
1729,Kolami-82_sun-2,1717,Kolami,82_sun,poddu,poddu,p o d d u,,KolipakamFW,,False,^ p o d d u $,default,p o d d u,d o p u
1730,Kota-82_sun-2,1718,Kota,82_sun,poɖutə,poɖutə,p o ɖ u t ə,,KolipakamFW,,False,^ p o ɖ u t ə $,default,p o d u t 3,3 d o p t u
1731,Koya-82_sun-1,1719,Koya,82_sun,poɖudu,poɖudu,p o ɖ u d u,,KolipakamFW,,False,^ p o ɖ u d u $,default,p o d u d u,d o p u
1732,Telugu-82_sun-2,1720,Telugu,82_sun,poddu,poddu,p o d d u,,KolipakamFW,,False,^ p o d d u $,default,p o d d u,d o p u
1733,Kurukh-82_sun-1,1721,Kurukh,82_sun,bi:ɖi,bi:ɖi,b iː ɖ i,,KolipakamFW,,False,^ b i: ɖ i $,default,b i d i,b d i
1734,Malto-82_sun-1,1722,Malto,82_sun,be:ɾdu,be:ɾdu,b eː ɾ d u,,KolipakamFW,,False,^ b e: ɾ d u $,default,b e r d u,b d e r u
1735,Badga-82_sun-1,1723,Badga,82_sun,ottə,ottə,o tː ə,,KolipakamFW,,False,^ o tt ə $,default,o t 3,3 o t
1736,Brahui-82_sun-1,1724,Brahui,82_sun,de,de,d e,,KolipakamFW,,False,^ d e $,default,d e,d e
1737,Kuwi-82_sun-1,1725,Kuwi,82_sun,ʋeda,ʋeda,ʋ e d a,,KolipakamFW,,False,^ ʋ e d a $,default,v e d a,a d e v
1738,Ollari_Gadba-82_sun-1,1726,Ollari_Gadba,82_sun,ʋele,ʋele,ʋ e l e,,KolipakamFW,,False,^ ʋ e l e $,default,v e l e,e l v
1739,Badga-83_swim-1,1727,Badga,83_swim,ni:ndə,ni:ndə,n iː n d ə,,KolipakamFW,,False,^ n i: n d ə $,default,n i n d 3,3 d i n
1740,Betta_Kurumba-83_swim-1,1728,Betta_Kurumba,83_swim,ni:nɖʒu,ni:nɖʒu,n iː n ɖ ʒ u,,KolipakamFW,,False,^ n i: n ɖ ʒ u $,default,n i n d Z u,Z d i n u
1741,Kannada-83_swim-1,1729,Kannada,83_swim,i:dʒo,i:dʒo,iː dʒ o,,Andronov1964,,False,^ i: dʒ o $,default,i dZ o,dZ i o
1742,Kota-83_swim-1,1730,Kota,83_swim,ni:tʃal,ni:tʃal,n iː tʃ a l,,KolipakamFW,,False,^ n i: tʃ a l $,default,n i tS a l,a i l n tS
1743,Koya-83_swim-1,1731,Koya,83_swim,i:ta,i:ta,iː t a,,KolipakamFW,,False,^ i: t a $,default,i t a,a i t
1744,Malayalam-83_swim-1,1732,Malayalam,83_swim,neentuga,neentuga,n e e n t u g a,,Andronov1964,,False,^ n e e n t u g a $,default,n e e n t u g a,a e g n t u
1745,Tamil-83_swim-1,1733,Tamil,83_swim,neentə,neentə,n e e n t ə,,Andronov1964,,False,^ n e e n t ə $,default,n e e n t 3,3 e n t
1746,Telugu-83_swim-1,1734,Telugu,83_swim,i:du,i:du,iː d u,,KolipakamFW,,False,^ i: d u $,default,i d u,d i u
1747,Toda-83_swim-1,1735,Toda,83_swim,ni:tʃal,ni:tʃal,n iː tʃ a l,,KolipakamFW,,False,^ n i: tʃ a l $,default,n i tS a l,a i l n tS
1748,Kurukh-83_swim-1,1736,Kurukh,83_swim,o:gna,o:gna,oː g n a,,KolipakamFW,,False,^ o: g n a $,default,o g n a,a g n o
1749,Malto-83_swim-1,1737,Malto,83_swim,ho:gpo,ho:gpo,h oː g p o,,KolipakamFW,,False,^ h o: g p o $,default,h o g p o,g h o p
1750,Kodava-83_swim-1,1738,Kodava,83_swim,mi:ɾodu,mi:ɾodu,m iː ɾ o d u,,KolipakamFW,,False,^ m i: ɾ o d u $,default,m i r o d u,d i m o r u
1751,Yeruva-83_swim-1,1739,Yeruva,83_swim,maɳa,maɳa,m a ɳ a,,KolipakamFW,,False,^ m a ɳ a $,default,m a n a,a m n
1752,Tulu-83_swim-1,1740,Tulu,83_swim,mi:ndaɾa,mi:ndaɾa,m iː n d a ɾ a,,KolipakamFW,,False,^ m i: n d a ɾ a $,default,m i n d a r a,a d i m n r
1753,Kolami-83_swim-1,1741,Kolami,83_swim,po:nim,po:nim,p oː n i m,,KolipakamFW,,False,^ p o: n i m $,default,p o n i m,i m n o p
1754,Gondi-83_swim-1,1742,Gondi,83_swim,pohem,pohem,p o h e m,,KolipakamFW,,False,^ p o h e m $,default,p o h e m,e h m o p
1755,Gondi-83_swim-2,1743,Gondi,83_swim,naɾi,naɾi,n a ɾ i,,KolipakamFW,,False,^ n a ɾ i $,default,n a r i,a i n r
1756,Brahui-83_swim-1,1744,Brahui,83_swim,beʂoling,beʂoling,b e ʂ o l i n g,,KolipakamFW,,False,^ b e ʂ o l i n g $,default,b e S o l i n g,S b e g i l n o
1757,Badga-84_tail-1,1745,Badga,84_tail,pa:lə,pa:lə,p aː l ə,,KolipakamFW,,False,^ p a: l ə $,default,p a l 3,3 a l p
1758,Betta_Kurumba-84_tail-1,1746,Betta_Kurumba,84_tail,ba:lə,ba:lə,b aː l ə,,KolipakamFW,,False,^ b a: l ə $,default,b a l 3,3 a b l
1759,Kannada-84_tail-1,1747,Kannada,84_tail,ba:la,ba:la,b aː l a,,KolipakamFW,,False,^ b a: l a $,default,b a l a,a b l
1760,Kodava-84_tail-1,1748,Kodava,84_tail,ba:lə,ba:lə,b aː l ə,,KolipakamFW,,False,^ b a: l ə $,default,b a l 3,3 a b l
1761,Kota-84_tail-1,1749,Kota,84_tail,ʋa:lə,ʋa:lə,ʋ aː l ə,,KolipakamFW,,False,^ ʋ a: l ə $,default,v a l 3,3 a l v
1762,Malayalam-84_tail-1,1750,Malayalam,84_tail,ʋa:lə,ʋa:lə,ʋ aː l ə,,KolipakamFW,,False,^ ʋ a: l ə $,default,v a l 3,3 a l v
1763,Tamil-84_tail-1,1751,Tamil,84_tail,ʋa:lə,ʋa:lə,ʋ aː l ə,,Andronov1964,,False,^ ʋ a: l ə $,default,v a l 3,3 a l v
1764,Telugu-84_tail-1,1752,Telugu,84_tail,vālamu,vālamu,v aː l a m u,,Andronov1964,,False,^ v ā l a m u $,default,v a l a m u,a l m u v
1765,Toda-84_tail-1,1753,Toda,84_tail,po:ɾsam,po:ɾsam,p oː ɾ s a m,,KolipakamFW,,False,^ p o: ɾ s a m $,default,p o r s a m,a m o p r s
1766,Yeruva-84_tail-1,1754,Yeruva,84_tail,ba:lu,ba:lu,b aː l u,,KolipakamFW,,False,^ b a: l u $,default,b a l u,a b l u
1767,Gondi-84_tail-1,1755,Gondi,84_tail,tokoɾ,tokoɾ,t o k o ɾ,,KolipakamFW,,False,^ t o k o ɾ $,default,t o k o r,k o r t
1768,Kolami-84_tail-1,1756,Kolami,84_tail,to:ka,to:ka,t oː k a,,KolipakamFW,,False,^ t o: k a $,default,t o k a,a k o t
1769,Koya-84_tail-1,1757,Koya,84_tail,toka:ɾ,toka:ɾ,t o k aː ɾ,,KolipakamFW,,False,^ t o k a: ɾ $,default,t o k a r,a k o r t
1770,Parji-84_tail-1,1758,Parji,84_tail,tōka,tōka,t oː k a,,Andronov1964,,False,^ t ō k a $,default,t o k a,a k o t
1771,Telugu-84_tail-2,1759,Telugu,84_tail,to:ka,to:ka,t oː k a,,KolipakamFW,,False,^ t o: k a $,default,t o k a,a k o t
1772,Kurukh-84_tail-1,1760,Kurukh,84_tail,kʰola,kʰola,kʰ o l a,,KolipakamFW,,False,^ kʰ o l a $,default,kh~ o l a,a kh~ l o
1773,Malto-84_tail-1,1761,Malto,84_tail,oli,oli,o l i,,KolipakamFW,,False,^ o l i $,default,o l i,i l o
1774,Tulu-84_tail-1,1762,Tulu,84_tail,bi:la,bi:la,b iː l a,,KolipakamFW,,False,^ b i: l a $,default,b i l a,a b i l
1775,Brahui-84_tail-1,1763,Brahui,84_tail,liʈʈik,liʈʈik,l i ʈː i k,,KolipakamFW,,False,^ l i ʈʈ i k $,default,l i t i k,i k l t
1776,Ollari_Gadba-84_tail-1,1764,Ollari_Gadba,84_tail,kindiɾ,kindiɾ,k i n d i ɾ,,KolipakamFW,,False,^ k i n d i ɾ $,default,k i n d i r,d i k n r
1777,Badga-85_that-1,1765,Badga,85_that,adə,adə,a d ə,,KolipakamFW,,False,^ a d ə $,default,a d 3,3 a d
1778,Betta_Kurumba-85_that-1,1766,Betta_Kurumba,85_that,adə,adə,a d ə,,KolipakamFW,,False,^ a d ə $,default,a d 3,3 a d
1779,Gondi-85_that-1,1767,Gondi,85_that,adu,adu,a d u,,KolipakamFW,,False,^ a d u $,default,a d u,a d u
1780,Kannada-85_that-1,1768,Kannada,85_that,ā,ā,aː,,Andronov1964,,False,^ ā $,default,a,a
1781,Kannada-85_that-2,1769,Kannada,85_that,adhu,adhu,a dʱ u,,KolipakamFW,,False,^ a dh u $,default,a d u,a d u
1782,Kodava-85_that-1,1770,Kodava,85_that,adə,adə,a d ə,,KolipakamFW,,False,^ a d ə $,default,a d 3,3 a d
1783,Kolami-85_that-1,1771,Kolami,85_that,ad,ad,a d,,KolipakamFW,,False,^ a d $,default,a d,a d
1784,Kota-85_that-1,1772,Kota,85_that,adhə,adhə,a dʱ ə,,KolipakamFW,,False,^ a dh ə $,default,a d 3,3 a d
