,ID,Local_ID,Language_ID,Parameter_ID,Value,Form,Segments,Comment,Source,Cognacy,Loan,Graphemes,Profile,asjp_forms,asjp_segs
404,Tulu-19_dog-1,400,Tulu,19_dog,na:ji,na:ji,n aː j i,,KolipakamFW,,False,^ n a: j i $,default,n a y i,a i n y
405,Yeruva-19_dog-1,401,Yeruva,19_dog,na:ji,na:ji,n aː j i,,KolipakamFW,,False,^ n a: j i $,default,n a y i,a i n y
406,Telugu-19_dog-1,402,Telugu,19_dog,kukka,kukka,k u kː a,EXCLUDE,KolipakamFW,,True,^ k u kk a $,default,k u k a,a k u
407,Malayalam-19_dog-2,403,Malayalam,19_dog,paʈʈi,paʈʈi,p a ʈː i,,KolipakamFW,,False,^ p a ʈʈ i $,default,p a t i,a i p t
408,Kurukh-19_dog-1,404,Kurukh,19_dog,alla,alla,a lː a,,KolipakamFW,,False,^ a ll a $,default,a l a,a l
409,Brahui-19_dog-1,405,Brahui,19_dog,kutʃak,kutʃak,k u tʃ a k,,KolipakamFW,,False,^ k u tʃ a k $,default,k u tS a k,a k tS u
410,Malto-19_dog-1,406,Malto,19_dog,kutʃtʃo,kutʃtʃo,k u tʃː o,,KolipakamFW,,False,^ k u tʃtʃ o $,default,k u tS o,k o tS u
411,Badga-20_drink-1,407,Badga,20_drink,kuɖapə,kuɖapə,k u ɖ a p ə,,KolipakamFW,,False,^ k u ɖ a p ə $,default,k u d a p 3,3 a d k p u
412,Betta_Kurumba-20_drink-1,408,Betta_Kurumba,20_drink,kuɖi ~ kujɾi,kuɖi,k u ɖ i,,KolipakamFW,,False,^ k u ɖ i $,default,k u d i,d i k u
413,Betta_Kurumba-20_drink-2,408,Betta_Kurumba,20_drink,kuɖi ~ kujɾi,kujɾi,k u j ɾ i,,KolipakamFW,,False,^ k u j ɾ i $,default,k u y r i,i k r u y
414,Kannada-20_drink-1,409,Kannada,20_drink,kuḍi-,kuḍi-,k u ɖ i,,Andronov1964,,False,^ k u ḍ i -$,default,k u d i,d i k u
415,Kannada-20_drink-2,410,Kannada,20_drink,kudijo:du,kudijo:du,k u d i j oː d u,,KolipakamFW,,False,^ k u d i j o: d u $,default,k u d i y o d u,d i k o u y
416,Kodava-20_drink-1,411,Kodava,20_drink,kuɖipa,kuɖipa,k u ɖ i p a,,KolipakamFW,,False,^ k u ɖ i p a $,default,k u d i p a,a d i k p u
417,Malayalam-20_drink-1,412,Malayalam,20_drink,kuṭi-,kuṭi-,k u ʈ i,,Andronov1964,,False,^ k u ṭ i -$,default,k u t i,i k t u
418,Malayalam-20_drink-2,413,Malayalam,20_drink,kudikkuga,kudikkuga,k u d i kː u g a,,KolipakamFW,,False,^ k u d i kk u g a $,default,k u d i k u g a,a d g i k u
419,Tamil-20_drink-1,414,Tamil,20_drink,kuɖi,kuɖi,k u ɖ i,,Andronov1964,,False,^ k u ɖ i $,default,k u d i,d i k u
420,Yeruva-20_drink-1,415,Yeruva,20_drink,kuɖipə,kuɖipə,k u ɖ i p ə,,KolipakamFW,,False,^ k u ɖ i p ə $,default,k u d i p 3,3 d i k p u
421,Telugu-20_drink-1,416,Telugu,20_drink,ta:gu,ta:gu,t aː g u,,KolipakamFW,,False,^ t a: g u $,default,t a g u,a g t u
422,Brahui-20_drink-1,417,Brahui,20_drink,kuning,kuning,k u n i n g,,KolipakamFW,,False,^ k u n i n g $,default,k u n i n g,g i k n u
423,Gondi-20_drink-1,418,Gondi,20_drink,un,un,u n,,KolipakamFW,,False,^ u n $,default,u n,n u
424,Kota-20_drink-1,419,Kota,20_drink,unatukə,unatukə,u n a t u k ə,,KolipakamFW,,False,^ u n a t u k ə $,default,u n a t u k 3,3 a k n t u
425,Koya-20_drink-1,420,Koya,20_drink,unnu,unnu,u nː u,,KolipakamFW,,False,^ u nn u $,default,u n u,n u
426,Kurukh-20_drink-1,421,Kurukh,20_drink,onna,onna,o nː a,,KolipakamFW,,False,^ o nn a $,default,o n a,a n o
427,Malto-20_drink-1,422,Malto,20_drink,ho:na:,ho:na:,h oː n aː,,KolipakamFW,,False,^ h o: n a: $,default,h o n a,a h n o
428,Ollari_Gadba-20_drink-1,423,Ollari_Gadba,20_drink,un,un,u n,,KolipakamFW,,False,^ u n $,default,u n,n u
429,Parji-20_drink-1,424,Parji,20_drink,un-,un-,u n,,Andronov1964,,False,^ u n -$,default,u n,n u
430,Toda-20_drink-1,425,Toda,20_drink,uʈʈudi,uʈʈudi,u ʈː u d i,,KolipakamFW,,False,^ u ʈʈ u d i $,default,u t u d i,d i t u
431,Tulu-20_drink-1,426,Tulu,20_drink,paɾijaɾa,paɾijaɾa,p a ɾ i j a ɾ a,,KolipakamFW,,False,^ p a ɾ i j a ɾ a $,default,p a r i y a r a,a i p r y
432,Kolami-20_drink-1,427,Kolami,20_drink,aniɾusa:t,aniɾusa:t,a n i ɾ u s aː t,,KolipakamFW,,False,^ a n i ɾ u s a: t $,default,a n i r u s a t,a i n r s t u
433,Tamil-21_dry-1,428,Tamil,21_dry,ularnta,ularnta,u l a r n t a,,Andronov1964,,False,^ u l a r n t a $,default,u l a r n t a,a l n r t u
434,Yeruva-21_dry-1,429,Yeruva,21_dry,unaku,unaku,u n a k u,,KolipakamFW,,False,^ u n a k u $,default,u n a k u,a k n u
435,Telugu-21_dry-1,430,Telugu,21_dry,eɳɖu,eɳɖu,e ɳ ɖ u,,KolipakamFW,,False,^ e ɳ ɖ u $,default,e n d u,d e n u
436,Kota-21_dry-1,431,Kota,21_dry,kanʈiko,kanʈiko,k a n ʈ i k o,,KolipakamFW,,False,^ k a n ʈ i k o $,default,k a n t i k o,a i k n o t
437,Kurukh-21_dry-1,432,Kurukh,21_dry,kʰajka,kʰajka,kʰ a j k a,,KolipakamFW,,False,^ kʰ a j k a $,default,kh~ a y k a,a k kh~ y
438,Malto-21_dry-1,433,Malto,21_dry,a:ika:,a:ika:,aː i k aː,,KolipakamFW,,False,^ a: i k a: $,default,a i k a,a i k
439,Tamil-21_dry-2,434,Tamil,21_dry,kaindadə,kaindadə,k a i n d a d ə,,KolipakamFW,,False,^ k a i n d a d ə $,default,k a i n d a d 3,3 a d i k n
440,Tamil-21_dry-3,435,Tamil,21_dry,ka:ndʒə,ka:ndʒə,k aː n dʒ ə,,KolipakamFW,,False,^ k a: n dʒ ə $,default,k a n dZ 3,3 a dZ k n
441,Brahui-21_dry-1,436,Brahui,21_dry,ba:ɾun,ba:ɾun,b aː ɾ u n,,KolipakamFW,,False,^ b a: ɾ u n $,default,b a r u n,a b n r u
442,Gondi-21_dry-1,437,Gondi,21_dry,ʋaʈʈa,ʋaʈʈa,ʋ a ʈː a,,KolipakamFW,,False,^ ʋ a ʈʈ a $,default,v a t a,a t v
443,Kannada-21_dry-1,438,Kannada,21_dry,battida,battida,b a tː i d a,,Andronov1964,,False,^ b a tt i d a $,default,b a t i d a,a b d i t
444,Koya-21_dry-1,439,Koya,21_dry,aɾta:d,aɾta:d,a ɾ t aː d,,KolipakamFW,,False,^ a ɾ t a: d $,default,a r t a d,a d r t
445,Malayalam-21_dry-1,440,Malayalam,21_dry,varaṇṭa,varaṇṭa,v a r a ɳ ʈ a,,Andronov1964,,False,^ v a r a ṇ ṭ a $,default,v a r a n t a,a n r t v
446,Badga-21_dry-1,441,Badga,21_dry,oɳikiladə,oɳikiladə,o ɳ i k i l a d ə,,KolipakamFW,,False,^ o ɳ i k i l a d ə $,default,o n i k i l a d 3,3 a d i k l n o
447,Kannada-21_dry-2,442,Kannada,21_dry,oɳagidu,oɳagidu,o ɳ a g i d u,,KolipakamFW,,False,^ o ɳ a g i d u $,default,o n a g i d u,a d g i n o u
448,Kodava-21_dry-1,443,Kodava,21_dry,oɳangina,oɳangina,o ɳ a n g i n a,,KolipakamFW,,False,^ o ɳ a n g i n a $,default,o n a n g i n a,a g i n o
449,Malayalam-21_dry-2,444,Malayalam,21_dry,uɳangija,uɳangija,u ɳ a n g i j a,,KolipakamFW,,False,^ u ɳ a n g i j a $,default,u n a n g i y a,a g i n u y
450,Toda-21_dry-1,445,Toda,21_dry,oɳikisi,oɳikisi,o ɳ i k i s i,,KolipakamFW,,False,^ o ɳ i k i s i $,default,o n i k i s i,i k n o s
451,Tulu-21_dry-1,446,Tulu,21_dry,nunguduna,nunguduna,n u n g u d u n a,,KolipakamFW,,False,^ n u n g u d u n a $,default,n u n g u d u n a,a d g n u
452,Koya-21_dry-2,447,Koya,21_dry,poɖi,poɖi,p o ɖ i,,KolipakamFW,,False,^ p o ɖ i $,default,p o d i,d i o p
453,Telugu-21_dry-2,448,Telugu,21_dry,poɖi,poɖi,p o ɖ i,,KolipakamFW,,False,^ p o ɖ i $,default,p o d i,d i o p
454,Betta_Kurumba-21_dry-1,449,Betta_Kurumba,21_dry,ajngənu ipədə,ajngənu ipədə,a j n g ə n u + i p ə d ə,,KolipakamFW,,False,^ a j n g ə n u + i p ə d ə $,default,a y n g 3 n u  i p 3 d 3, 3 a d g i n p u y
455,Kolami-21_dry-1,450,Kolami,21_dry,a:tiɾ,a:tiɾ,aː t i ɾ,,KolipakamFW,,False,^ a: t i ɾ $,default,a t i r,a i r t
456,Badga-22_ear-1,451,Badga,22_ear,kiʋi,kiʋi,k i ʋ i,,KolipakamFW,,False,^ k i ʋ i $,default,k i v i,i k v
457,Betta_Kurumba-22_ear-1,452,Betta_Kurumba,22_ear,kiʋija,kiʋija,k i ʋ i j a,,KolipakamFW,,False,^ k i ʋ i j a $,default,k i v i y a,a i k v y
458,Brahui-22_ear-1,453,Brahui,22_ear,xaf,xaf,x a f,,KolipakamFW,,False,^ x a f $,default,x a f,a f x
459,Gondi-22_ear-1,454,Gondi,22_ear,keʋu,keʋu,k e ʋ u,,KolipakamFW,,False,^ k e ʋ u $,default,k e v u,e k u v
460,Kannada-22_ear-1,455,Kannada,22_ear,kiʋi,kiʋi,k i ʋ i,,KolipakamFW,,False,^ k i ʋ i $,default,k i v i,i k v
461,Kodava-22_ear-1,456,Kodava,22_ear,kemi,kemi,k e m i,,KolipakamFW,,False,^ k e m i $,default,k e m i,e i k m
462,Kolami-22_ear-1,457,Kolami,22_ear,keʋ,keʋ,k e ʋ,,KolipakamFW,,False,^ k e ʋ $,default,k e v,e k v
463,Kota-22_ear-1,458,Kota,22_ear,keʋə,keʋə,k e ʋ ə,,KolipakamFW,,False,^ k e ʋ ə $,default,k e v 3,3 e k v
464,Koya-22_ear-1,459,Koya,22_ear,keʋ,keʋ,k e ʋ,,KolipakamFW,,False,^ k e ʋ $,default,k e v,e k v
465,Koya-22_ear-2,460,Koya,22_ear,keʋk,keʋk,k e ʋ k,,KolipakamFW,,False,^ k e ʋ k $,default,k e v k,e k v
466,Kurukh-22_ear-1,461,Kurukh,22_ear,kʰebda,kʰebda,kʰ e b d a,,KolipakamFW,,False,^ kʰ e b d a $,default,kh~ e b d a,a b d e kh~
467,Kuwi-22_ear-1,462,Kuwi,22_ear,kiɾiju,kiɾiju,k i ɾ i j u,,KolipakamFW,,False,^ k i ɾ i j u $,default,k i r i y u,i k r u y
468,Malayalam-22_ear-1,463,Malayalam,22_ear,tʃeʋi,tʃeʋi,tʃ e ʋ i,,KolipakamFW,,False,^ tʃ e ʋ i $,default,tS e v i,e i tS v
469,Ollari_Gadba-22_ear-1,464,Ollari_Gadba,22_ear,kekal,kekal,k e k a l,,KolipakamFW,,False,^ k e k a l $,default,k e k a l,a e k l
470,Parji-22_ear-1,465,Parji,22_ear,kekol,kekol,k e k o l,,Andronov1964,,False,^ k e k o l $,default,k e k o l,e k l o
471,Telugu-22_ear-1,466,Telugu,22_ear,tʃeʋi,tʃeʋi,tʃ e ʋ i,,KolipakamFW,,False,^ tʃ e ʋ i $,default,tS e v i,e i tS v
472,Toda-22_ear-1,467,Toda,22_ear,kili,kili,k i l i,,KolipakamFW,,False,^ k i l i $,default,k i l i,i k l
473,Tulu-22_ear-1,468,Tulu,22_ear,kebi,kebi,k e b i,,KolipakamFW,,False,^ k e b i $,default,k e b i,b e i k
474,Yeruva-22_ear-1,469,Yeruva,22_ear,kemi,kemi,k e m i,,KolipakamFW,,False,^ k e m i $,default,k e m i,e i k m
475,Malayalam-22_ear-2,470,Malayalam,22_ear,kātu,kātu,k aː t u,,Andronov1964,,False,^ k ā t u $,default,k a t u,a k t u
476,Tamil-22_ear-1,471,Tamil,22_ear,ka:də,ka:də,k aː d ə,,Andronov1964,,False,^ k a: d ə $,default,k a d 3,3 a d k
477,Malto-22_ear-1,472,Malto,22_ear,daɾti:,daɾti:,d a ɾ t iː,,KolipakamFW,,False,^ d a ɾ t i: $,default,d a r t i,a d i r t
478,Gondi-23_earth-1,473,Gondi,23_earth,mannə,mannə,m a nː ə,,KolipakamFW,,False,^ m a nn ə $,default,m a n 3,3 a m n
479,Kannada-23_earth-1,474,Kannada,23_earth,maɳɳu,maɳɳu,m a ɳ ɳ u,,KolipakamFW,,False,^ m a ɳ ɳ u $,default,m a n n u,a m n u
480,Kodava-23_earth-1,475,Kodava,23_earth,mannə,mannə,m a nː ə,,KolipakamFW,,False,^ m a nn ə $,default,m a n 3,3 a m n
481,Malayalam-23_earth-1,476,Malayalam,23_earth,mannə,mannə,m a nː ə,,KolipakamFW,,False,^ m a nn ə $,default,m a n 3,3 a m n
482,Tamil-23_earth-1,477,Tamil,23_earth,mannə,mannə,m a nː ə,,Andronov1964,,False,^ m a nn ə $,default,m a n 3,3 a m n
483,Telugu-23_earth-1,478,Telugu,23_earth,mannu,mannu,m a nː u,,KolipakamFW,,False,^ m a nn u $,default,m a n u,a m n u
484,Tulu-23_earth-1,479,Tulu,23_earth,mannə,mannə,m a nː ə,,KolipakamFW,,False,^ m a nn ə $,default,m a n 3,3 a m n
485,Ollari_Gadba-23_earth-1,480,Ollari_Gadba,23_earth,tukud,tukud,t u k u d,,KolipakamFW,,False,^ t u k u d $,default,t u k u d,d k t u
486,Parji-23_earth-1,481,Parji,23_earth,tūk,tūk,t uː k,,Andronov1964,,False,^ t ū k $,default,t u k,k t u
487,Kurukh-23_earth-1,482,Kurukh,23_earth,kʰekʰel,kʰekʰel,kʰ e kʰ e l,,KolipakamFW,,False,^ kʰ e kʰ e l $,default,kh~ e kh~ e l,e kh~ l
488,Toda-23_earth-1,483,Toda,23_earth,koɖə,koɖə,k o ɖ ə,,KolipakamFW,,False,^ k o ɖ ə $,default,k o d 3,3 d k o
489,Koya-23_earth-1,484,Koya,23_earth,maʈʈi,maʈʈi,m a ʈː i,,KolipakamFW,,False,^ m a ʈʈ i $,default,m a t i,a i m t
490,Telugu-23_earth-2,485,Telugu,23_earth,maʈʈi,maʈʈi,m a ʈː i,,KolipakamFW,,False,^ m a ʈʈ i $,default,m a t i,a i m t
491,Betta_Kurumba-23_earth-1,486,Betta_Kurumba,23_earth,bu:mi,bu:mi,b uː m i,LOAN,KolipakamFW,,True,^ b u: m i $,default,b u m i,b i m u
492,Kolami-23_earth-1,487,Kolami,23_earth,bʰu:mi,bʰu:mi,bʱ uː m i,LOAN,KolipakamFW,,True,^ bʰ u: m i $,default,b u m i,b i m u
493,Kota-23_earth-1,488,Kota,23_earth,bʰulo:gam,bʰulo:gam,bʱ u l oː g a m,,KolipakamFW,,False,^ bʰ u l o: g a m $,default,b u l o g a m,a b g l m o u
494,Kuwi-23_earth-1,489,Kuwi,23_earth,bʰumi,bʰumi,bʱ u m i,LOAN,KolipakamFW,,True,^ bʰ u m i $,default,b u m i,b i m u
495,Malto-23_earth-1,490,Malto,23_earth,bʰumi,bʰumi,bʱ u m i,LOAN,KolipakamFW,,True,^ bʰ u m i $,default,b u m i,b i m u
496,Kuwi-23_earth-2,491,Kuwi,23_earth,iɾa:,iɾa:,i ɾ aː,,KolipakamFW,,False,^ i ɾ a: $,default,i r a,a i r
497,Brahui-23_earth-1,492,Brahui,23_earth,ɖaga:ɾ,ɖaga:ɾ,ɖ a g aː ɾ,,KolipakamFW,,False,^ ɖ a g a: ɾ $,default,d a g a r,a d g r
498,Badga-24_eat-1,493,Badga,24_eat,timbə,timbə,t i m b ə,,KolipakamFW,,False,^ t i m b ə $,default,t i m b 3,3 b i m t
499,Betta_Kurumba-24_eat-1,494,Betta_Kurumba,24_eat,tinn,tinn,t i nː,,KolipakamFW,,False,^ t i nn $,default,t i n,i n t
500,Kannada-24_eat-1,495,Kannada,24_eat,tinnu,tinnu,t i nː u,,Andronov1964,,False,^ t i nn u $,default,t i n u,i n t u
501,Kodava-24_eat-1,496,Kodava,24_eat,tinə,tinə,t i n ə,,KolipakamFW,,False,^ t i n ə $,default,t i n 3,3 i n t
502,Kota-24_eat-1,497,Kota,24_eat,tin atej,tin atej,t i n + a t e j,,KolipakamFW,,False,^ t i n + a t e j $,default,t i n  a t e y, a e i n t y
503,Koya-24_eat-1,498,Koya,24_eat,tinnu,tinnu,t i nː u,,KolipakamFW,,False,^ t i nn u $,default,t i n u,i n t u
504,Kuwi-24_eat-1,499,Kuwi,24_eat,tinu,tinu,t i n u,,KolipakamFW,,False,^ t i n u $,default,t i n u,i n t u
505,Malayalam-24_eat-1,500,Malayalam,24_eat,tinnuga,tinnuga,t i nː u g a,,KolipakamFW,,False,^ t i nn u g a $,default,t i n u g a,a g i n t u
506,Ollari_Gadba-24_eat-1,501,Ollari_Gadba,24_eat,tin,tin,t i n,,KolipakamFW,,False,^ t i n $,default,t i n,i n t
507,Parji-24_eat-1,502,Parji,24_eat,tin-,tin-,t i n,,Andronov1964,,False,^ t i n -$,default,t i n,i n t
508,Telugu-24_eat-1,503,Telugu,24_eat,tinu,tinu,t i n u,,KolipakamFW,,False,^ t i n u $,default,t i n u,i n t u
509,Yeruva-24_eat-1,504,Yeruva,24_eat,tinno:,tinno:,t i nː oː,,KolipakamFW,,False,^ t i nn o: $,default,t i n o,i n o t
510,Tamil-24_eat-1,505,Tamil,24_eat,sa:pədə,sa:pədə,s aː p ə d ə,,Andronov1964,,False,^ s a: p ə d ə $,default,s a p 3 d 3,3 a d p s
511,Tulu-24_eat-1,506,Tulu,24_eat,uɳa:ɾa,uɳa:ɾa,u ɳ aː ɾ a,,KolipakamFW,,False,^ u ɳ a: ɾ a $,default,u n a r a,a n r u
512,Kurukh-24_eat-1,507,Kurukh,24_eat,mokʰna,mokʰna,m o kʰ n a,,KolipakamFW,,False,^ m o kʰ n a $,default,m o kh~ n a,a kh~ m n o
513,Toda-24_eat-1,508,Toda,24_eat,toɾtin,toɾtin,t o ɾ t i n,,KolipakamFW,,False,^ t o ɾ t i n $,default,t o r t i n,i n o r t
514,Brahui-24_eat-1,509,Brahui,24_eat,kuning,kuning,k u n i n g,,KolipakamFW,,False,^ k u n i n g $,default,k u n i n g,g i k n u
515,Malto-24_eat-1,510,Malto,24_eat,dʒa:go:lpah,dʒa:go:lpah,dʒ aː g oː l p a h,,KolipakamFW,,False,^ dʒ a: g o: l p a h $,default,dZ a g o l p a h,a dZ g h l o p
516,Malto-24_eat-2,511,Malto,24_eat,lapah,lapah,l a p a h,,KolipakamFW,,False,^ l a p a h $,default,l a p a h,a h l p
517,Kolami-24_eat-1,512,Kolami,24_eat,a:ntisatun,a:ntisatun,aː n t i s a t u n,,KolipakamFW,,False,^ a: n t i s a t u n $,default,a n t i s a t u n,a i n s t u
518,Gondi-24_eat-1,513,Gondi,24_eat,dʒeʋi,dʒeʋi,dʒ e ʋ i,,KolipakamFW,,False,^ dʒ e ʋ i $,default,dZ e v i,dZ e i v
519,Badga-25_egg-1,514,Badga,25_egg,moʈʈe,moʈʈe,m o ʈː e,,KolipakamFW,,False,^ m o ʈʈ e $,default,m o t e,e m o t
520,Kannada-25_egg-1,515,Kannada,25_egg,moʈʈe,moʈʈe,m o ʈː e,,KolipakamFW,,False,^ m o ʈʈ e $,default,m o t e,e m o t
521,Kodava-25_egg-1,516,Kodava,25_egg,muʈʈe,muʈʈe,m u ʈː e,,KolipakamFW,,False,^ m u ʈʈ e $,default,m u t e,e m t u
522,Kota-25_egg-1,517,Kota,25_egg,mooʈə,mooʈə,m o o ʈ ə,,KolipakamFW,,False,^ m o o ʈ ə $,default,m o o t 3,3 m o t
523,Malayalam-25_egg-1,518,Malayalam,25_egg,muʈʈa,muʈʈa,m u ʈː a,,KolipakamFW,,False,^ m u ʈʈ a $,default,m u t a,a m t u
524,Tamil-25_egg-1,519,Tamil,25_egg,muʈʈe,muʈʈe,m u ʈː e,,Andronov1964,,False,^ m u ʈʈ e $,default,m u t e,e m t u
525,Toda-25_egg-1,520,Toda,25_egg,muʈʈe,muʈʈe,m u ʈː e,,KolipakamFW,,False,^ m u ʈʈ e $,default,m u t e,e m t u
526,Yeruva-25_egg-1,521,Yeruva,25_egg,muʈʈe,muʈʈe,m u ʈː e,,KolipakamFW,,False,^ m u ʈʈ e $,default,m u t e,e m t u
527,Telugu-25_egg-1,522,Telugu,25_egg,guɖɖu,guɖɖu,g u ɖː u,,KolipakamFW,,False,^ g u ɖɖ u $,default,g u d u,d g u
528,Kannada-25_egg-2,523,Kannada,25_egg,tatti,tatti,t a tː i,,KolipakamFW,,False,^ t a tt i $,default,t a t i,a i t
529,Tulu-25_egg-1,524,Tulu,25_egg,ketti,ketti,k e tː i,,KolipakamFW,,False,^ k e tt i $,default,k e t i,e i k t
530,Koya-25_egg-1,525,Koya,25_egg,gaɾbam,gaɾbam,g a ɾ b a m,,KolipakamFW,,False,^ g a ɾ b a m $,default,g a r b a m,a b g m r
531,Ollari_Gadba-25_egg-1,526,Ollari_Gadba,25_egg,kaɾbə,kaɾbə,k a ɾ b ə,,KolipakamFW,,False,^ k a ɾ b ə $,default,k a r b 3,3 a b k r
532,Betta_Kurumba-25_egg-1,527,Betta_Kurumba,25_egg,mujɾgi,mujɾgi,m u j ɾ g i,,KolipakamFW,,False,^ m u j ɾ g i $,default,m u y r g i,g i m r u y
533,Brahui-25_egg-1,528,Brahui,25_egg,xuahae,xuahae,x u a h a e,,KolipakamFW,,False,^ x u a h a e $,default,x u a h a e,a e h u x
534,Brahui-25_egg-2,529,Brahui,25_egg,baƐdƐ,baƐdƐ,b a ɛ d ɛ,,KolipakamFW,,False,^ b a Ɛ d Ɛ $,default,b a E d E,E a b d
535,Malto-25_egg-1,530,Malto,25_egg,ɾaɾapa:ndu,ɾaɾapa:ndu,ɾ a ɾ a p aː n d u,,KolipakamFW,,False,^ ɾ a ɾ a p a: n d u $,default,r a r a p a n d u,a d n p r u
536,Kurukh-25_egg-1,531,Kurukh,25_egg,bi:,bi:,b iː,,KolipakamFW,,False,^ b i: $,default,b i,b i
537,Kolami-25_egg-1,532,Kolami,25_egg,sanku,sanku,s a n k u,,KolipakamFW,,False,^ s a n k u $,default,s a n k u,a k n s u
538,Gondi-25_egg-1,533,Gondi,25_egg,mi:ndʒ,mi:ndʒ,m iː n dʒ,,KolipakamFW,,False,^ m i: n dʒ $,default,m i n dZ,dZ i m n
539,Kuwi-25_egg-1,534,Kuwi,25_egg,tala,tala,t a l a,,KolipakamFW,,False,^ t a l a $,default,t a l a,a l t
540,Badga-26_eye-1,535,Badga,26_eye,kaɳɳə,kaɳɳə,k a ɳ ɳ ə,,KolipakamFW,,False,^ k a ɳ ɳ ə $,default,k a n n 3,3 a k n
541,Betta_Kurumba-26_eye-1,536,Betta_Kurumba,26_eye,kaɳɳu,kaɳɳu,k a ɳ ɳ u,,KolipakamFW,,False,^ k a ɳ ɳ u $,default,k a n n u,a k n u
542,Brahui-26_eye-1,537,Brahui,26_eye,xan,xan,x a n,,KolipakamFW,,False,^ x a n $,default,x a n,a n x
543,Kannada-26_eye-1,538,Kannada,26_eye,kaɳɳə,kaɳɳə,k a ɳ ɳ ə,,KolipakamFW,,False,^ k a ɳ ɳ ə $,default,k a n n 3,3 a k n
544,Kodava-26_eye-1,539,Kodava,26_eye,kaɳɳə,kaɳɳə,k a ɳ ɳ ə,,KolipakamFW,,False,^ k a ɳ ɳ ə $,default,k a n n 3,3 a k n
545,Kolami-26_eye-1,540,Kolami,26_eye,kan,kan,k a n,,KolipakamFW,,False,^ k a n $,default,k a n,a k n
546,Kota-26_eye-1,541,Kota,26_eye,kaɳɳə,kaɳɳə,k a ɳ ɳ ə,,KolipakamFW,,False,^ k a ɳ ɳ ə $,default,k a n n 3,3 a k n
547,Koya-26_eye-1,542,Koya,26_eye,koɳɖ,koɳɖ,k o ɳ ɖ,,KolipakamFW,,False,^ k o ɳ ɖ $,default,k o n d,d k n o
548,Kurukh-26_eye-1,543,Kurukh,26_eye,kʰann,kʰann,kʰ a nː,,KolipakamFW,,False,^ kʰ a nn $,default,kh~ a n,a kh~ n
549,Kuwi-26_eye-1,544,Kuwi,26_eye,kanu,kanu,k a n u,,KolipakamFW,,False,^ k a n u $,default,k a n u,a k n u
550,Malayalam-26_eye-1,545,Malayalam,26_eye,kaɳɳə,kaɳɳə,k a ɳ ɳ ə,,KolipakamFW,,False,^ k a ɳ ɳ ə $,default,k a n n 3,3 a k n
551,Malto-26_eye-1,546,Malto,26_eye,a:ndu,a:ndu,aː n d u,,KolipakamFW,,False,^ a: n d u $,default,a n d u,a d n u
552,Ollari_Gadba-26_eye-1,547,Ollari_Gadba,26_eye,kaɳul,kaɳul,k a ɳ u l,,KolipakamFW,,False,^ k a ɳ u l $,default,k a n u l,a k l n u
553,Parji-26_eye-1,548,Parji,26_eye,kan,kan,k a n,,Andronov1964,,False,^ k a n $,default,k a n,a k n
554,Tamil-26_eye-1,549,Tamil,26_eye,kaɳɳə,kaɳɳə,k a ɳ ɳ ə,,Andronov1964,,False,^ k a ɳ ɳ ə $,default,k a n n 3,3 a k n
555,Telugu-26_eye-1,550,Telugu,26_eye,kannu,kannu,k a nː u,,KolipakamFW,,False,^ k a nn u $,default,k a n u,a k n u
556,Toda-26_eye-1,551,Toda,26_eye,kaɳ,kaɳ,k a ɳ,,KolipakamFW,,False,^ k a ɳ $,default,k a n,a k n
557,Tulu-26_eye-1,552,Tulu,26_eye,kaɳɳu,kaɳɳu,k a ɳ ɳ u,,KolipakamFW,,False,^ k a ɳ ɳ u $,default,k a n n u,a k n u
558,Yeruva-26_eye-1,553,Yeruva,26_eye,kaɳɳə,kaɳɳə,k a ɳ ɳ ə,,KolipakamFW,,False,^ k a ɳ ɳ ə $,default,k a n n 3,3 a k n
559,Malayalam-26_eye-2,554,Malayalam,26_eye,ne:tɾam,ne:tɾam,n eː t ɾ a m,LOAN,KolipakamFW,,True,^ n e: t ɾ a m $,default,n e t r a m,a e m n r t
560,Gondi-26_eye-1,555,Gondi,26_eye,kəɖə,kəɖə,k ə ɖ ə,,KolipakamFW,,False,^ k ə ɖ ə $,default,k 3 d 3,3 d k
561,Badga-27_fat-1,556,Badga,27_fat,koɭəppə,koɭəppə,k o ɭ ə pː ə,,KolipakamFW,,False,^ k o ɭ ə pp ə $,default,k o L 3 p 3,3 L k o p
562,Gondi-27_fat-1,557,Gondi,27_fat,koɾondʒ,koɾondʒ,k o ɾ o n dʒ,,KolipakamFW,,False,^ k o ɾ o n dʒ $,default,k o r o n dZ,dZ k n o r
563,Kannada-27_fat-1,558,Kannada,27_fat,kobbu,kobbu,k o bː u,,KolipakamFW,,False,^ k o bb u $,default,k o b u,b k o u
564,Kota-27_fat-1,559,Kota,27_fat,koɭupu,koɭupu,k o ɭ u p u,,KolipakamFW,,False,^ k o ɭ u p u $,default,k o L u p u,L k o p u
565,Koya-27_fat-1,560,Koya,27_fat,kodoʋo:s,kodoʋo:s,k o d o ʋ oː s,,KolipakamFW,,False,^ k o d o ʋ o: s $,default,k o d o v o s,d k o s v
566,Malayalam-27_fat-1,561,Malayalam,27_fat,koɻuppə,koɻuppə,k o ɻ u pː ə,,KolipakamFW,,False,^ k o ɻ u pp ə $,default,k o r u p 3,3 k o p r u
567,Parji-27_fat-1,562,Parji,27_fat,koṛukuḍ,koṛukuḍ,k o ɽ u k u ɖ,,Andronov1964,,False,^ k o ṛ u k u ḍ $,default,k o r u k u d,d k o r u
568,Tamil-27_fat-1,563,Tamil,27_fat,koɻuppə,koɻuppə,k o ɻ u pː ə,,Andronov1964,,False,^ k o ɻ u pp ə $,default,k o r u p 3,3 k o p r u
569,Telugu-27_fat-1,564,Telugu,27_fat,koʋʋu (noun),koʋʋu,k o ʋː u,,KolipakamFW,,False,^ k o ʋʋ u $,default,k o v u,k o u v
570,Toda-27_fat-1,565,Toda,27_fat,koɻəppə,koɻəppə,k o ɻ ə pː ə,,KolipakamFW,,False,^ k o ɻ ə pp ə $,default,k o r 3 p 3,3 k o p r
571,Koya-27_fat-2,566,Koya,27_fat,la:ʋ,la:ʋ,l aː ʋ,,KolipakamFW,,False,^ l a: ʋ $,default,l a v,a l v
572,Telugu-27_fat-2,567,Telugu,27_fat,la:ʋu(adjective),la:ʋu,l aː ʋ u,,KolipakamFW,,False,^ l a: ʋ u $,default,l a v u,a l u v
573,Kurukh-27_fat-1,568,Kurukh,27_fat,neʈa,neʈa,n e ʈ a,,KolipakamFW,,False,^ n e ʈ a $,default,n e t a,a e n t
574,Brahui-27_fat-1,569,Brahui,27_fat,tʃaɾpi:,tʃaɾpi:,tʃ a ɾ p iː,,KolipakamFW,,False,^ tʃ a ɾ p i: $,default,tS a r p i,a i p r tS
575,Kodava-27_fat-1,570,Kodava,27_fat,tʃeɾabi,tʃeɾabi,tʃ e ɾ a b i,,KolipakamFW,,False,^ tʃ e ɾ a b i $,default,tS e r a b i,a b e i r tS
576,Tulu-27_fat-1,571,Tulu,27_fat,tʃeɾabi,tʃeɾabi,tʃ e ɾ a b i,,KolipakamFW,,False,^ tʃ e ɾ a b i $,default,tS e r a b i,a b e i r tS
577,Yeruva-27_fat-1,572,Yeruva,27_fat,tʃiɾabi,tʃiɾabi,tʃ i ɾ a b i,,KolipakamFW,,False,^ tʃ i ɾ a b i $,default,tS i r a b i,a b i r tS
578,Betta_Kurumba-27_fat-1,573,Betta_Kurumba,27_fat,tanniʋi,tanniʋi,t a nː i ʋ i,,KolipakamFW,,False,^ t a nn i ʋ i $,default,t a n i v i,a i n t v
579,Betta_Kurumba-27_fat-2,574,Betta_Kurumba,27_fat,teɾija,teɾija,t e ɾ i j a,,KolipakamFW,,False,^ t e ɾ i j a $,default,t e r i y a,a e i r t y
580,Malto-27_fat-1,575,Malto,27_fat,nedʒdʒa,nedʒdʒa,n e dʒː a,,KolipakamFW,,False,^ n e dʒdʒ a $,default,n e dZ a,a dZ e n
581,Ollari_Gadba-27_fat-1,576,Ollari_Gadba,27_fat,me:n,me:n,m eː n,,KolipakamFW,,False,^ m e: n $,default,m e n,e m n
582,Badga-28_feather-1,577,Badga,28_feather,ɾakke,ɾakke,ɾ a kː e,,KolipakamFW,,False,^ ɾ a kk e $,default,r a k e,a e k r
583,Kota-28_feather-1,578,Kota,28_feather,ɾe:kə,ɾe:kə,ɾ eː k ə,,KolipakamFW,,False,^ ɾ e: k ə $,default,r e k 3,3 e k r
584,Tamil-28_feather-1,579,Tamil,28_feather,ɾekke,ɾekke,ɾ e kː e,,Andronov1964,,False,^ ɾ e kk e $,default,r e k e,e k r
585,Toda-28_feather-1,580,Toda,28_feather,iɾakke,iɾakke,i ɾ a kː e,,KolipakamFW,,False,^ i ɾ a kk e $,default,i r a k e,a e i k r
586,Malayalam-28_feather-1,581,Malayalam,28_feather,tu:ʋalə,tu:ʋalə,t uː ʋ a l ə,,KolipakamFW,,False,^ t u: ʋ a l ə $,default,t u v a l 3,3 a l t u v
587,Kannada-28_feather-1,582,Kannada,28_feather,gari,gari,g a r i,,Andronov1964,,False,^ g a r i $,default,g a r i,a g i r
588,Telugu-28_feather-1,583,Telugu,28_feather,i:ka,i:ka,iː k a,,KolipakamFW,,False,^ i: k a $,default,i k a,a i k
589,Kannada-28_feather-2,584,Kannada,28_feather,tupaʈa,tupaʈa,t u p a ʈ a,,KolipakamFW,,False,^ t u p a ʈ a $,default,t u p a t a,a p t u
590,Kodava-28_feather-1,585,Kodava,28_feather,topaʈa,topaʈa,t o p a ʈ a,,KolipakamFW,,False,^ t o p a ʈ a $,default,t o p a t a,a o p t
591,Yeruva-28_feather-1,586,Yeruva,28_feather,to:pəʈa:,to:pəʈa:,t oː p ə ʈ aː,,KolipakamFW,,False,^ t o: p ə ʈ a: $,default,t o p 3 t a,3 a o p t
592,Koya-28_feather-1,587,Koya,28_feather,geɾk,geɾk,g e ɾ k,,KolipakamFW,,False,^ g e ɾ k $,default,g e r k,e g k r
593,Tulu-28_feather-1,588,Tulu,28_feather,huʋi,huʋi,h u ʋ i,,KolipakamFW,,False,^ h u ʋ i $,default,h u v i,h i u v
594,Betta_Kurumba-28_feather-1,589,Betta_Kurumba,28_feather,tiʋija,tiʋija,t i ʋ i j a,,KolipakamFW,,False,^ t i ʋ i j a $,default,t i v i y a,a i t v y
595,Gondi-28_feather-1,590,Gondi,28_feather,buɾa,buɾa,b u ɾ a,,KolipakamFW,,False,^ b u ɾ a $,default,b u r a,a b r u
596,Kolami-28_feather-1,591,Kolami,28_feather,bull,bull,b u lː,,KolipakamFW,,False,^ b u ll $,default,b u l,b l u
597,Brahui-28_feather-1,592,Brahui,28_feather,paɾɾƐ,paɾɾƐ,p a ɾ ɾ ɛ,,KolipakamFW,,False,^ p a ɾ ɾ Ɛ $,default,p a r r E,E a p r
598,Malto-28_feather-1,593,Malto,28_feather,paki:,paki:,p a k iː,,KolipakamFW,,False,^ p a k i: $,default,p a k i,a i k p
599,Kurukh-28_feather-1,594,Kurukh,28_feather,pentʃo,pentʃo,p e n tʃ o,,KolipakamFW,,False,^ p e n tʃ o $,default,p e n tS o,e n o p tS
600,Tamil-29_fire-1,595,Tamil,29_fire,neruppu,neruppu,n e r u pː u,,Andronov1964,,False,^ n e r u pp u $,default,n e r u p u,e n p r u
601,Telugu-29_fire-1,596,Telugu,29_fire,nippu,nippu,n i pː u,,KolipakamFW,,False,^ n i pp u $,default,n i p u,i n p u
602,Betta_Kurumba-29_fire-1,597,Betta_Kurumba,29_fire,tissə ~ titʃtʃa,tissə,t i sː ə,,KolipakamFW,,False,^ t i ss ə $,default,t i s 3,3 i s t
603,Betta_Kurumba-29_fire-2,597,Betta_Kurumba,29_fire,tissə ~ titʃtʃa,titʃtʃa,t i tʃː a,,KolipakamFW,,False,^ t i tʃtʃ a $,default,t i tS a,a i t tS
